sourceCode,sourceName,sourceFrequency,sourceAutoAssignedConceptIds,ADD_INFO:spanish_name,matchScore,mappingStatus,conceptId,comment
902.26,Injuries Of Branches Primary Superior Mesenteric Artery,0,196851,LESION DE RAMAS PRIMARIAS DE LA ARTERIA MESENTERICA SUPERIOR,0.8503928780555725,APPROVED,196851,
576.2,Bile Duct Obstruction,4031,201066,OBSTRUCCION DE CONDUCTO BILIAR,0.8697593212127686,APPROVED,201066,
569.86,Dieulafoy Lesion (Hemorrhagic) Bowel,0,198798,LESION DE DIEULAFOY (HEMORRAGICA) DE INTESTINO,0.8940324783325195,APPROVED,198798,
569.87,Vomiting Fecaloid,0,45757414,VOMITO FECALOIDEO,0.7056972980499268,APPROVED,45757414,
902.27,Bottom Mesenteric Artery Injury,0,199959,LESION DE ARTERIA MESENTERICA INFERIOR,0.6742116212844849,APPROVED,199959,
359.24,Drug-Induced Myotonia,0,73183,MIOTONIA INDUCIDA POR FARMACOS,0.7845625877380371,APPROVED,73183,
359.23,Condrodistrofia Myotonic,0,441280,CONDRODISTROFIA MIOTONICA,0.5713188648223877,APPROVED,441280,
359.22,Myotonia Congenita,0,4212349,MIOTONIA CONGENITA,1.0,APPROVED,4212349,
902.29,Celiac Artery Injuries And Mesenteric (Other),0,195124,LESION DE ARTERIA CELIACA Y MESENTERICA (OTRAS),0.7547339200973511,APPROVED,195124,
902.3,Porta Vein Injuries And Spleen,0,4052200,LESION DE VENAS PORTA Y ESPLENICA,0.6575137972831726,APPROVED,4052200,
959.6,"Trauma Hip O Thigh, Unspecified",4019,44783029,"TRAUMATISMO DE CADERA O MUSLO, NO ESPECIFICADO",0.47041624784469604,APPROVED,44783029,
358.9,Myoneural Unspecified Disorders,0,377263,TRASTORNOS MIONEURALES NO ESPECIFICADOS,0.8470064401626587,APPROVED,377263,
902.31,Vein Injuries And Primary Subdivisions Superior Mesenteric,0,197422,LESION DE VENA MESENTERICA SUPERIOR Y SUBDIVISIONES PRIMARIA,0.8522095680236816,APPROVED,197422,
358.8,Other Specified Disorders Myoneural,0,377263,OTROS TRASTORNOS MIONEURALES ESPECIFICADOS,0.9052173495292664,APPROVED,377263,
902.32,Injuries Of Lower Vena Mesenteric,0,442789,LESION DE VENA MESENTERICA INFERIOR,0.41740548610687256,APPROVED,442789,
358.31,Eaton Lambert Syndrome In Neoplastic Disease,0,43531175,SINDROME DE LAMBERT EATON EN ENFERMEDAD NEOPLASICA,0.7918426990509033,APPROVED,43531175,
902.33,Injury Portal Vein,0,197154,LESION DE VENA PORTA,1.0,APPROVED,197154,
642.4,Preeclampsia Mild Or Nos,745,4062906;444094,PREECLAMPSIA LEVE O NEOM,0.5445617437362671,AUTO_MAPPED,444094,
250.71,Diabetes With Manif. Circ. Peripheral. I Type As Indicated No Uncontrolled,4015,318712,DIABETES CON MANIF. CIRC. PERIF. TIPO I NO INDICADA COMO INCONTROLADA,0.4292719066143036,APPROVED,318712,
482.83,Pneumonia Other Bacteria Gram-Negative,744,258180,NEUMONIA POR OTRAS BACTERIAS GRAM-NEGATIVOS,0.8548951745033264,APPROVED,258180,
902.34,Spleen Vein Injuries,0,197714,LESION DE VENA ESPLENICA,0.6186867952346802,APPROVED,197714,
358.30,"Eaton Lambert Syndrome, Not Specified",0,4237155,"SINDROME DE LAMBERT EATON, NO ESPECIFICADO",0.7750754356384277,APPROVED,4237155,
610.4,Breast Duct Ectasia,744,438808,ECTASIA DE CONDUCTO MAMARIO,0.7880789041519165,APPROVED,438808,
902.39,Other Injuries Of Portal Vein / Spleen,0,4052200,LESION DE OTRA VENA PORTA/ESPLENICA,0.5752152800559998,APPROVED,4052200,
902.4,Kidney Injury Of Blood Vessels,0,195400,LESION DE VASOS SANGUINEOS RENALES,0.6464717984199524,APPROVED,195400,
525.8,Alteration And Other Dental Estruct. Support Specified,4011,201603,OTRA ALTERACION DENTAL Y DE ESTRUCT. DE APOYO ESPECIFICADOS,0.42822569608688354,APPROVED,201603,
902.40,Renal Injury Of Vessel Not Specified,0,195400,LESION DE VASO RENAL NO ESPECIFICADO,0.6806269288063049,APPROVED,195400,
358.3,Eaton Lambert Syndrome,0,4237155,SINDROME DE LAMBERT EATON,1.0,APPROVED,4237155,
358.2,Myoneural Toxic Disorders,0,76396,TRASTORNOS MIONEURALES TOXICOS,0.876694917678833,APPROVED,76396,
808.8,Neom Pelvic Fracture-Closed,4010,77129,FRACTURA DE PELVIS NEOM-CERRADA,0.6117812991142273,APPROVED,77129,
298.1,Type Of Rough Psicosis,3996,4100382,PSICOSIS DE TIPO AGITADO,0.3133663833141327,APPROVED,4100382,
V18.0,Family Hist Of Diabetes Mellitus,3996,4167217,HIST FAMILIAR DE DIABETES MELLITUS,0.0,UNCHECKED,0,
438.7,Vision Disorders,3995,43531583,TRASTORNOS DE LA VISION,0.22939027845859528,APPROVED,43531583,
0DJ68ZZ,,3995,2749125,,0.0,UNCHECKED,0,
93.18,,3984,4029804,,0.0,UNCHECKED,0,
358.1,Sort Myasthenic Syndromes In Diseases. Other Concept.,0,432893,SINDROMES MIASTENICOS EN ENFERMEDADES CLASIF. OTROS CONCEPT.,0.6108789443969727,APPROVED,432893,
902.41,Renal Artery Injury,0,192767,LESION DE ARTERIA RENAL,1.0,APPROVED,192767,
924.2,"Contusion Of Ankle And Foot, Salvo Finger (S) Of Pie",3980,4051770,"CONTUSION DE TOBILLO Y PIE, SALVO DEDO(S) DEL PIE",0.5391305685043335,APPROVED,4051770,
358,Myoneural Toxic Disorders,0,377263,TRASTORNOS MIONEURALES TOXICOS,0.8305184841156006,APPROVED,377263,
368.15,Other Artifacts And Phenomena Entoptics Visuals,3977,380707,OTRAS DISTORSIONES VISUALES Y FENOMENOS ENTOPTICOS,0.6222658753395081,APPROVED,380707,
902.42,Renal Vein Injuries,0,195125,LESION DE VENA RENAL,0.8334659934043884,APPROVED,195125,
250.51,Diabetes With Manif. Ophthalmologist. I Type As Indicated No Uncontrolled,3975,42538169,DIABETES CON MANIF. OFTALM. TIPO I NO INDICADA COMO INCONTROLADA,0.4650380313396454,APPROVED,42538169,
658.81,Otr Alter Cavid / Memb Amniot Ncoc-Parida C / S Pat Antepar / Part,744,438815;4041280,OTR ALTER CAVID/MEMB AMNIOT NCOC-PARIDA C/S PAT ANTEPAR/PART,0.3071238696575165,AUTO_MAPPED,438815,
902.49,Renal Injury Another Glass,0,195400,LESION DE OTRO VASO RENAL,0.41816848516464233,APPROVED,195400,
426.7,Excitement Atrioventricular Anomala,3973,313224,EXCITACION AURICULO-VENTRICULAR ANOMALA,0.7666952013969421,APPROVED,313224,
08DK3ZZ,,3971,2740237,,0.0,UNCHECKED,0,
357.3,Polyneuropathy Malignant Disease,0,378420,POLINEUROPATIA EN ENFERMEDAD MALIGNA,0.9430740475654602,APPROVED,378420,
372.41,Peripheral Pterygium Stationary,744,372646,PTERIGION PERIFERICO ESTACIONARIO,0.9167448282241821,APPROVED,372646,
21.02,,744,4305187,,0.0,UNCHECKED,0,
54.98,,744,4324124,,0.0,UNCHECKED,0,
289.0,Secondary Polycythemia,3970,435790,POLICITEMIA SECUNDARIA,1.0,APPROVED,435790,
279.4,Unrated Autoimmune Disease. Under Another Concept,743,434621,ENFERMEDAD DE AUTOINMUNIDAD NO CLASIF. BAJO OTRO CONCEPTO,0.5597906112670898,APPROVED,434621,
844,Sprains And Strains Knee And Leg,3970,76836,ESGUINCES Y TORCEDURAS DE RODILLA Y PIERNA,0.8692961931228638,APPROVED,76836,
902.5,Injury Of Blood Vessels Ilíacos,0,198019,LESION DE VASOS SANGUINEOS ILIACOS,0.4728432297706604,APPROVED,198019,
J91.0,,743,254390,,0.0,AUTO_MAPPED_TO_1,254390,
Z80.3,,743,4167217,,0.0,UNCHECKED,0,
B96.4,,743,433405,,0.0,AUTO_MAPPED_TO_1,433405,
216.3,N. Benig.Piel Of Other Parties And Parties Not Face Especif.De,3968,140966,N. BENIG.PIEL DE OTRAS PARTES Y PARTES NO ESPECIF.DE LA CARA,0.27752187848091125,APPROVED,140966,
572,Liver Abscess And Sequels Of Chronic Liver Enfernedad,0,194984,ABSCESO HEPATICO Y SECUELAS DE ENFERNEDAD HEPATICA CRONICA,0.65541672706604,APPROVED,194984,
902.50,"Lesion Vessel (S) Iliac (S), Unspecified",0,198019,"LESION DE VASO(S) ILIACO(S), NO ESPECIFICADO",0.6234033107757568,APPROVED,198019,
357.1,Polyneuropathy Collagen Vascular Disease,0,375260,POLINEUROPATIA EN ENFERMEDAD VASCULAR DE COLAGENO,0.9572154879570007,APPROVED,375260,
902.52,Vein Injuries Hypogastric,0,443644,LESION DE VENA HIPOGASTRICA,0.7948082089424133,APPROVED,443644,
572.1,Pyaemia Portal,0,192670,PIEMIA PORTAL,0.9146643877029419,APPROVED,192670,
362.11,Hypertensive Retinopathy,3962,376965,RETINOPATIA HIPERTENSIVA,1.0,APPROVED,376965,
374,Other Disorders Of Eyelid,742,376125,OTROS TRASTORNOS DE LOS PARPADOS,1.0,APPROVED,376125,
902.53,Injury Iliac Artery,0,200881,LESION DE ARTERIA ILIACA,1.0,APPROVED,200881,
099.0,Chancroid,742,138973,CHANCROIDE,1.0,APPROVED,138973,
902.54,Injuries Of Vein Iliac,0,80576,LESION DE VENA ILIACA,0.6540650725364685,APPROVED,80576,
366.52,Other Secondary Cataract Without Vision Dimming,741,441846,"OTRA CATARATA SECUNDARIA, SIN OSCURECIMIENTO DE VISION",0.2726484537124634,APPROVED,441846,
356.3,Refsum Disease,0,4101333,ENFERMEDAD DE REFSUM,1.0,APPROVED,4101333,
573.2,Hepatitis In Other Enfer. Infect. Sort. Under Another Concept,0,194087,HEPATITIS EN OTRAS ENFER. INFECC. CLASIF. BAJO OTRO CONCEPTO,0.3588520288467407,APPROVED,194087,
902.55,Uterine Artery Injury,0,194797,LESION DE ARTERIA UTERINA,1.0,APPROVED,194797,
355.71,Causalgia Lower Limb,0,4237198,CAUSALGIA DE MIEMBRO INFERIOR,1.0,APPROVED,4237198,
238.73,High Grade Myelodysplastic Syndrome,741,136949,SINDROME MIELODISPLASICO DE ALTO GRADO,0.9376941323280334,APPROVED,136949,
355.7,Other Mononeuritis Lower Limb,0,4177483,OTRA MONONEURITIS DE MIEMBRO INFERIOR,0.9443203210830688,APPROVED,4177483,
902.56,Uterine Vein Injuries,0,200882,LESION DE VENA UTERINA,0.838175356388092,APPROVED,200882,
573.4,Liver Infarction,0,194417,INFARTO HEPATICO,0.8795231580734253,APPROVED,194417,
573.5,Hepatopulmonary Syndrome,0,4159144,SINDROME HEPATOPULMONAR,1.0,APPROVED,4159144,
742.59,Spinal Cord Abnormalities -Other Uncoded,741,133013,ANOMALIAS MEDULA ESPINAL -OTROS NO CODIFICADOS,0.2993883788585663,APPROVED,133013,
902.59,Injury Another Glass Iliac,0,198019,LESION DE OTRO VASO ILIACO,0.46357378363609314,APPROVED,198019,
355.4,Internal Popliteal Nerve Injury,0,4161309,LESION DEL NERVIO POPLITEO INTERNO,0.6927624344825745,APPROVED,4161309,
998.89,Other Specified Complications,3957,442019,OTRAS COMPLICACIONES ESPECIFICADAS,0.6650108098983765,APPROVED,442019,
V62.5,Legal Circumstances,3956,4329840,CIRCUNSTANCIAS LEGALES,0.0,UNCHECKED,0,
902.8,Other Injuries Of Vessels Specified Sanguin Abdomen / Pelvis,0,438600,LESION DE OTROS VASOS SANGUIN ESPECIFICADOS ABDOMEN/PELVIS,0.659487783908844,APPROVED,438600,
355.2,Other Injury Femoral Nerve,0,439807,OTRA LESION DE NERVIO FEMORAL,0.6517930030822754,APPROVED,439807,
902.81,Ovarian Artery Injury,0,198599,LESION DE ARTERIA OVARICA,1.0,APPROVED,198599,
902.82,Ovarian Vein Injuries,0,197148,LESION DE VENA OVARICA,0.8720410466194153,APPROVED,197148,
528.00,"Stomatitis And Mucositis, Unspecified",3952,138455,"ESTOMATITIS Y MUCOSITIS, SIN ESPECIFICAR",1.0,APPROVED,138455,
353.5,Neuralgic Disuse Atrophy,0,377271,AMIOTROFIA NEURALGICA,0.5639208555221558,APPROVED,377271,
996.31,Complication Mechanics Urethral Catheter (Ongoing),740,194847,COMPLICACION MECANICA DE CATETER URETRAL (PERMANENTE),0.5285817980766296,APPROVED,194847,
902.87,Multivessel Injury Of Abdomen / Pelvis,0,432480,LESION DE MULTIPLES VASOS DE ABDOMEN/PELVIS,0.6711669564247131,APPROVED,432480,
353.3,Injuries Roots Dorsales Ncoc,0,137858,LESIONES DE LAS RAICES DORSALES NCOC,0.22513246536254883,APPROVED,137858,
716.4,Transient Arthropathy,740,81930,ARTROPATIA TRANSITORIA,1.0,APPROVED,81930,
352.6,Paralisis Multiple Cranial Nerve,0,437543,PARALISIS MULTIPLE DE NERVIOS CRANEALES,0.7322854995727539,APPROVED,437543,
618.9,Prolapse Genital Neom,3949,199876,PROLAPSO GENITAL NEOM,0.7218103408813477,APPROVED,199876,
902.89,Injuries Of Vessel Specified Ncoc Of Other Abdomen / Pelvis,0,438600,LESION DE OTRO VASO ESPECIFICADO NCOC DE ABDOMEN/PELVIS,0.6040015816688538,APPROVED,438600,
352.5,Nerve Disorders Hypoglossal (12§),0,435537,TRASTORNOS DEL NERVIO HIPOGLOSO (12§),0.5571895241737366,APPROVED,435537,
352.4,Accessory Nerve Disorders (11§),0,437547,TRASTORNOS DEL NERVIO ACCESORIO (11§),0.5538245439529419,APPROVED,437547,
352.3,Nerve Disorders Pneumogastric (10§),0,432307,TRASTORNOS DEL NERVIO PNEUMOGASTRICO (10§),0.5415335893630981,APPROVED,432307,
721.8,Other Related Disorders From Column,740,44782549,OTROS TRASTORNOS CONEXOS DE LA COLUMNA,0.45496073365211487,APPROVED,44782549,
415.11,Stroke And Pulmonary Iatrogenic Infarction,740,40480461,EMBOLIA E INFARTO PULMONAR YATROGENICO,0.6523123979568481,APPROVED,40480461,
574.7,Calculations Gallbladder And Biliary Duct With Other Cholecystitis,0,201614,CALCULOS VESICULA Y CONDUCTO BILIAR CON OTRAS COLECISTITIS,0.846361517906189,APPROVED,201614,
379.03,Anterior Scleritis,739,441582,ESCLERITIS ANTERIOR,1.0,APPROVED,441582,
G35,,739,374919,,0.0,AUTO_MAPPED_TO_1,374919,
E11.42,,739,37017432,,0.0,AUTO_MAPPED_TO_1,37017432,
903,Injury Of Upper Limb Blood Vessels Of,0,201164,LESION DE VASOS SANGUINEOS DE EXTREMIDAD SUPERIOR,0.7408676743507385,APPROVED,201164,
574.71,"Calculations And Duct Vesicula Bil. With Colecist., With Obstruc",0,201614,"CALCULOS VESICULA Y CONDUCTO BIL. CON COLECIST., CON OBSTRUC",0.39567238092422485,APPROVED,201614,
903.0,Injury Of Blood Vessels Axillary,0,4055472,LESION DE VASOS SANGUINEOS AXILARES,0.8746223449707031,APPROVED,4055472,
00124,Despair,3948,,DESESPERANZA,1.0,APPROVED,4062071,
903.00,"Axillary Vessel Injury, Not Specified",0,4055472,"LESION DE VASO AXILAR, NO ESPECIFICADO",0.8642879128456116,APPROVED,4055472,
574.8,Calculations Gallbladder And Biliary Duct With Acute And Chronic Cholecystitis,0,443421,CALCULOS VESICULA Y CONDUCTO BILIAR CON COLECISTITIS AGUDA Y CRONICA,0.8641302585601807,APPROVED,443421,
728.3,Other Specific Muscle Disorders,3948,72618,OTRAS ALTERACIONES MUSCULARES ESPECIFICAS,1.0,APPROVED,72618,
51.87,,3944,46271144,,0.0,UNCHECKED,0,
574.80,Calculations Vesic.Y Cond. Bil. With Colec. Acute And Cron. Without Me,0,443421,"CALCULOS VESIC.Y COND. BIL. CON COLEC. AGUDA Y CRON., SIN ME",0.2522006928920746,APPROVED,443421,
433.1,Occlusion And Stenosis Carotid Arteries-Precerebral,3944,4288310,OCLUSION Y ESTENOSIS ARTERIAS PRECEREBRALES-ARTERIA CAROTIDA,0.6615945100784302,APPROVED,4288310,
903.01,Artery Injury Axillary,0,438608,LESION DE ARTERIA AXILAR,0.9431855082511902,APPROVED,438608,
903.02,Vein Injuries Axillary,0,434531,LESION DE VENA AXILAR,0.7363084554672241,APPROVED,434531,
396.2,Enough. Mitral Valve Stenosis-Valv. Aortic,3941,320115,INSUF. VALVULA MITRAL-ESTENOSIS VALV. AORTICA,0.39130669832229614,APPROVED,320115,
Z95.1,,3941,4163883,,0.0,UNCHECKED,0,
616.2,Gland Cyst Bartholin,3938,259865,QUISTE DE LA GLANDULA DE BARTHOLIN,0.7722886800765991,APPROVED,259865,
574.81,"Calculations Vesic.Y Cond. Bil. With Colec. Acute And Chron., Ob",0,443421,"CALCULOS VESIC.Y COND. BIL. CON COLEC. AGUDA Y CRON., CON OB",0.25010377168655396,APPROVED,443421,
241.9,Nontoxic Nodular Goiter And Unspecified,3934,136661,BOCIO NODULAR NO TOXICO Y NO ESPECIFICADO,0.9205916523933411,APPROVED,136661,
97.62,,3932,4197673,,0.0,UNCHECKED,0,
V49.86,State Of No 'Do Not Resuscitate',3931,4119499,ESTADO DE NO 'NO REANIMAR',0.0,UNCHECKED,0,
452,Portal Vein Thrombosis,3925,199837,TROMBOSIS DE VENA PORTA,1.0,APPROVED,199837,
79.16,,3924,4195117,,0.0,UNCHECKED,0,
V15.06,Allergy Arachnoids,3924,4214956,ALERGIA A INSECTOS Y ARACNIDOS,0.0,UNCHECKED,0,
671.82,Compl Other Venous Emba / Puerp-Parida Complication Partum,739,313543;4041280,"OTRA COMPL VENOSA EMBA/PUERP-PARIDA, COMPLICACION POSTPARTO",0.4304623305797577,AUTO_MAPPED,313543,
Z80.0,,739,4167217,,0.0,UNCHECKED,0,
60,Labor Problems,739,2003944,PROBLEMAS LABORALES,0.0,UNCHECKED,0,
352.2,Nerve Disorders Other Glosofarigeo (9§),0,435803,OTROS TRASTORNOS DEL NERVIO GLOSOFARIGEO (9§),0.3069385290145874,APPROVED,435803,
295.34,Paranoid Schizophrenia - Acute Exacerbation Chronicle,3921,437243,ESQUIZOFRENIA PARANOIDE - CRONICA CON EXACERBACION AGUDA,0.8757708072662354,APPROVED,437243,
Z3A.38,,3919,443871,,0.0,AUTO_MAPPED_TO_1,443871,
90.92,,3918,2007273,,0.0,UNCHECKED,0,
352.0,Olfactory Nerve Disorders (1§),0,435253,TRASTORNOS DEL NERVIO OLFATORIO (1§),0.5727769732475281,APPROVED,435253,
304.0,Type Opioid Dependence,3918,438120,DEPENDENCIA DE TIPO OPIOIDE,0.8960849642753601,APPROVED,438120,
65.63,,3914,40488381,,0.0,UNCHECKED,0,
447.1,Taper Artery,3909,317305,ESTRECHAMIENTO DE ARTERIA,0.41412588953971863,APPROVED,317305,
352,Cranial Nerve Disorders Other,0,441848,TRASTORNOS DE OTROS NERVIOS CRANEALES,0.8865456581115723,APPROVED,441848,
587,Renal Sclerosis Neom,3899,4140207,ESCLEROSIS RENAL NEOM,0.8345443606376648,APPROVED,4140207,
V45.75,Acquired Absence Of Stomach,3895,4215685,AUSENCIA ADQUIRIDA DE ESTOMAGO,0.0,UNCHECKED,0,
BW00ZZZ,,3895,2792808,,0.0,UNCHECKED,0,
575.1,Other Cholecystitis,0,192956,OTRA COLECISTITIS,1.0,APPROVED,192956,
351.1,Ganglionitis Geniculate,0,376963,GANGLIONITIS GENICULADA,0.8744393587112427,APPROVED,376963,
903.1,Brachial Vessel Injury,0,201164,LESION DE VASOS BRAQUIALES,0.8605344891548157,APPROVED,201164,
903.2,Radiales Vessel Injury,0,314208,LESION DE VASOS RADIALES,0.7343659400939941,APPROVED,314208,
362.34,Transient Retinal Arterial Occlusion,3887,433195,OCLUSION ARTERIAL TRANSITORIA RETINIANA,1.0,APPROVED,433195,
903.3,Ulnar Vessel Injury,0,441725,LESION DE VASOS CUBITALES,0.8389819264411926,APPROVED,441725,
903.4,Artery Injury Palmar,0,313902,LESION DE ARTERIA PALMAR,0.90146404504776,APPROVED,313902,
350.9,Nerve Disorder Trigeminal Unspecified,0,440703,TRASTORNO DEL NERVIO TRIGEMINO SIN ESPECIFICAR,0.8336601257324219,APPROVED,440703,
V23.8,Control Other High Risk Pregnancy,738,444094;45765728,CONTROL DE OTRO EMBARAZO DE ALTO RIESGO,0.6393460035324097,AUTO_MAPPED,444094,
350.8,Other Specified Disorders Trigeminal Nerve,0,440703,OTROS TRASTORNOS ESPECIFICADOS DEL NERVIO TRIGEMINO,0.913333535194397,APPROVED,440703,
903.5,Digital Vessel Injury,0,194209,LESION DE VASOS DIGITALES,0.8103028535842896,APPROVED,194209,
349.8,Other Specified Disorders Of The Nervous System,0,376337,OTROS TRASTORNOS ESPECIFICADOS DEL SISTEMA NERVIOSO,0.9226198792457581,APPROVED,376337,
349.39,Other Tear Dural,0,4134439,OTRO DESGARRO DURAL,0.9242174625396729,APPROVED,4134439,
576.3,Drilling Bile Duct,0,192957,PERFORACION DE CONDUCTO BILIAR,0.5094872713088989,APPROVED,192957,
349.31,Accidental Tearing Puncture Or Dural During A Procedure,0,4134544,PUNCION O DESGARRO ACCIDENTAL DE LA DURAMADRE DURANTE UN PROCEDIMIENTO,0.7674025297164917,APPROVED,4134544,
576.5,Spasm Of Sphincter Of Oddi,0,441067,ESPASMO DEL ESFINTER DE ODDI,1.0,APPROVED,441067,
349.3,Tear Dural,0,4134439,DESGARRO DURAL,0.808939516544342,APPROVED,4134439,
349.1,Complication Snc Originating In Implanted Surgical Device.,0,377855,COMPLICACION SNC CON ORIGEN EN DISPOSITIVO IMPLANTADO QUIR.,0.3977411091327667,APPROVED,377855,
348.81,Temporal Sclerosis,0,40491436,ESCLEROSIS TEMPORAL,1.0,APPROVED,40491436,
655.83,Fetal Abnormality Ncoc-Complication Antepartum,738,36712695;444094,ANORMALIDAD FETAL NCOC-COMPLICACION ANTEPARTO,0.4798348546028137,AUTO_MAPPED,444094,
R00.0,,738,444070,,0.0,AUTO_MAPPED_TO_1,444070,
347.11,Narcolepsy In Conditions Classified Elsewhere With Cataplexy,0,437854,NARCOLEPSIA EN AFECCIONES CLASIFICADAS EN OTRO LUGAR CON CATAPLEJIA,1.0,APPROVED,437854,
911.0,Abrasion Trunk Or Burn-Uninfected,738,199192,ABRASION O QUEMADURA DE TRONCO-SIN INFECCION,0.5355352759361267,APPROVED,199192,
347.10,Narcolepsy In Conditions Classified Elsewhere Without Cataplexy,0,436100,NARCOLEPSIA EN AFECCIONES CLASIFICADAS EN OTRO LUGAR SIN CATAPLEJIA,0.9670929908752441,APPROVED,436100,
405.99,Other Secondary Hypertension Neom,737,319826,OTRA HIPERTENSION SECUNDARIA NEOM,0.8999461531639099,APPROVED,319826,
903.8,Other Vessels Specified Injury Upper Extremity,0,201164,LESION DE OTROS VASOS ESPECIFICADOS DE EXTREMIDAD SUPERIOR,0.7670652270317078,APPROVED,201164,
347.1,Narcolepsy In Conditions Classified Elsewhere,0,436100,NARCOLEPSIA EN AFECCIONES CLASIFICADAS EN OTRO LUGAR,1.0,APPROVED,436100,
347.01,Narcolepsy With Cataplexy,0,437854,NARCOLEPSIA CON CATAPLEJIA,1.0,APPROVED,437854,
579.1,Tropical Sprue,0,193521,ESPRUE TROPICAL,1.0,APPROVED,193521,
F02.81,,737,43530666;374888,,0.0,UNCHECKED,0,
579.2,Blind Loop Syndrome (Sind. Of Blind Asa),0,196732,SINDROME DE BLIND LOOP (SIND. DE ASA CIEGA),0.6219707727432251,APPROVED,196732,
347,Cataplexy & Narcolepsy,0,437854,CATAPLEJIA Y NARCOLEPSIA,0.78364497423172,APPROVED,437854,
354.8,Mononeuritis Other Upper Limb,737,43531027,OTRAS MONONEURITIS DEL MIEMBRO SUPERIOR,0.8861052393913269,APPROVED,43531027,
38.69,,737,2002128,,0.0,UNCHECKED,0,
00028,Risk Of Deficit Fluid Volume,3885,,RIESGO DE DEFICIT DE VOLUMEN DE LIQUIDOS,0.797415554523468,UNCHECKED,4172611,
162.5,"N. Malignant Lower Lobe, Bronchus Or Lung",3878,4157454,"N. MALIGNA LOBULO INFERIOR, BRONQUIO O PULMON",0.7613663673400879,APPROVED,4157454,
903.9,Blood Vessel Injury Neom Tip Superior,0,201164,LESION DE VASO SANGUINEO NEOM DE EXTREMIDAD SUPERIOR,0.5945314168930054,APPROVED,201164,
854.06,Les Intracr Otr Type / Nos-No Traum Intracr Open-Coma Neom,737,437385,LES INTRACR OTR TIPO/NEOM-NO TRAUM INTRACR ABIER-COMA NEOM,0.1887916624546051,AUTO_MAPPED_TO_1,437385,
346.93,"Migraña Not Specified, With Migraine Treatment Resistant Well Displayed Status With Migrainosus",0,377844;443615,"MIGRAÑA NO ESPECIFICADA, CON MIGRAÑA RESISTENTE AL TRATAMIENTO, ASI INDICADA, CON ESTATUS MIGRAÑOSO",0.46379342675209045,AUTO_MAPPED,377844,
579.4,Pancreatic Steatorrhea,0,200146,ESTEATORREA PANCREATICA,1.0,APPROVED,200146,
212.0,"N. Benigna Nasal Cavity, Middle Ear And Sinuses",736,442110,"N. BENIGNA DE CAVIDAD NASAL, OIDO MEDIO Y SENOS ACCESORIOS",0.5700106024742126,APPROVED,442110,
714,Arthritis Rheumatoid And Other Inflammatory Poliartropias,3878,4291025,ARTRITIS REUMATOIDES Y OTRAS POLIARTROPIAS INFLAMATORIAS,0.7230175733566284,APPROVED,4291025,
191.8,N. Malignant Brain Of Other Parties,736,372849,N. MALIGNA DE OTRAS PARTES CEREBRO,0.5532232522964478,APPROVED,372849,
294.11,Dementia In Diseases Classified Elsewhere With Alte,3877,374888,DEMENCIA EN ENFERMEDADES CLASIFICADAS EN OTRO LUGAR CON ALTE,0.8526968359947205,APPROVED,374888,
88.94,,3876,4242443,,0.0,UNCHECKED,0,
904,Injuries Of Vessels Of Lower Limb And Sites Neom,0,321726,LESION DE VASOS DE EXTREMIDAD INFERIOR Y SITIOS NEOM,0.4739541709423065,APPROVED,321726,
346.92,"Migraña Unspecified, Without Mention Of Migraine Treatment Resistant With Status Migrainosus",0,377844,"MIGRAÑA NO ESPECIFICADA, SIN MENCION DE MIGRAÑA RESISTENTE AL TRATAMIENTO, CON ESTATUS MIGRAÑOSO",0.5959755182266235,APPROVED,377844,
524.63,Articular Disc Disruption (Reduced / Unreduced),3875,74399,PERTURBACION DEL DISCO ARTICULAR (REDUCIDO/NO REDUCIDO),0.43152204155921936,APPROVED,74399,
904.0,Common Femoral Artery Injury,0,75126,LESION DE ARTERIA FEMORAL COMUN,1.0,APPROVED,75126,
128.0,Toxocariasis,0,432249,TOXOCARIASIS,1.0,APPROVED,432249,
295.82,Schizophrenia Other Specified - Chronicle,3868,4105330,OTRA ESQUIZOFRENIA ESPECIFICADA - CRONICA,0.7315635681152344,APPROVED,4105330,
904.1,Injury Sfa,0,73085,LESION DE ARTERIA FEMORAL SUPERFICIAL,0.2808283269405365,APPROVED,73085,
346.91,"Migraña Not Specified, With Migraine Treatment Resistant Well Displayed Status Unmentioned Migrainosus",0,443615,"MIGRAÑA NO ESPECIFICADA, CON MIGRAÑA RESISTENTE AL TRATAMIENTO, ASI INDICADA, SIN MENCION DE ESTATUS MIGRAÑOSO",0.4167727530002594,APPROVED,443615,
276.5,Volume Equil.Osmot./Electrolit./Acido-Basico-Disminucion Disorder,3861,436375,TRASTORNO EQUIL.OSMOT./ELECTROLIT./ACIDO-BASICO-DISMINUCION DE VOLUMEN,0.13173788785934448,AUTO_MAPPED_TO_1,436375,
37.23,,3853,4148375,,0.0,UNCHECKED,0,
V06.5,Need Tetanus-Diphtheria (Td) (Dt),3852,37109774,NECESIDAD DE VACUNA CONTRA TETANOS-DIFTERIA (TD) (DT),0.0,UNCHECKED,0,
205.1,Chronic Myelogenous Leukemia,736,134603,LEUCEMIA MIELOIDE CRONICA,1.0,APPROVED,134603,
56.99,,736,2003749,,0.0,UNCHECKED,0,
230.1,Esophageal Carcinoma,736,28109,CARCINOMA DE ESOFAGO,0.6394965052604675,APPROVED,28109,
128,Helminthiasis Other And Unspecified Helminthiasis,0,441793,OTRAS HELMINTIASIS Y HELMINTIASIS SIN ESPECIFICAR,0.8952680230140686,APPROVED,441793,
253.0,Acromegaly And Pituitary Gigantism,735,28403,ACROMEGALIA Y GIGANTISMO,1.0,APPROVED,28403,
753.12,"Polycystic Kidney, Unspecified Type",3849,4220238,"RIÑON POLIQUISTICO, TIPO NO ESPECIFICADO",1.0,APPROVED,4220238,
523.33,Acute Periodontitis,3849,132943,PERIODONTITIS AGUDA,1.0,APPROVED,132943,
998.6,Persistent Postoperative Fistula,3848,436003,FISTULA POSTOPERATORIA PERSISTENTE,1.0,APPROVED,436003,
Z98.41,,3846,4178305,,0.0,UNCHECKED,0,
346.83,"Other Forms Of Migraine, Migraine Resistant To Treatment And Displayed Status With Migrainosus",0,377844;443615,"OTRAS FORMAS DE MIGRAÑA, CON MIGRAÑA RESISTENTE AL TRATAMIENTO, ASI INDICADA, CON ESTATUS MIGRAÑOSO",0.6042028069496155,AUTO_MAPPED,377844,
381.1,Serous Otitis Media Chronicle,3845,381301,OTITIS MEDIA SEROSA CRONICA,0.8481738567352295,APPROVED,381301,
904.2,Femoral Vein Injuries,0,437149,LESION DE VENAS FEMORALES,0.8522208333015442,APPROVED,437149,
249.0,Diabetes Mellitus School Without Mention Of Complication,735,195771,DIABETES MELLITUS SECUNDARIA SIN MENCION DE COMPLICACION,0.7218102216720581,APPROVED,195771,
127.8,Helminthiasis Intestinal Mixta,0,194873,HELMINTIASIS INTESTINAL MIXTA,0.6944056153297424,APPROVED,194873,
692.74,Other Solar Radiation Dermatitis Chronicle,735,4239682,OTRA DERMATITIS CRONICA POR RADIACION SOLAR,0.7483143210411072,APPROVED,4239682,
95.41,,735,4071702,,0.0,UNCHECKED,0,
719.0,Joint Leak,3845,79903,DERRAME ARTICULAR,0.30602848529815674,APPROVED,79903,
904.4,Injury Of Blood Vessels Popliteal,0,442581,LESION DE VASOS SANGUINEOS POPLITEOS,0.8708347678184509,APPROVED,442581,
403.10,"Chronic Kidney Disease Hypertensive Benign Chronic Kidney Disease With Stadium I To Stage Iv, Or Unspecified",734,193493,"ENFERMEDAD DEL RIÑON HIPERTENSIVA CRONICA BENIGNA CON ENFERMEDAD CRONICA DEL RIÑON ESTADIO I A ESTADIO IV, O SIN ESPECIFICAR",0.8225936889648438,APPROVED,193493,
99.59,,734,2008354,,0.0,UNCHECKED,0,
37.79,,734,2001581,,0.0,UNCHECKED,0,
904.40,"Lesion Vessel (S) Popliteal (S), Unspecified",0,442581,"LESION DE VASO(S) POPLITEO(S), SIN ESPECIFICAR",0.6647431254386902,APPROVED,442581,
300.20,Phobia Not Specified,3844,4304010,FOBIA NO ESPECIFICADA,0.7041736841201782,APPROVED,4304010,
346.82,Other Forms Of Migraine Without Mention Of Migraine Treatment Resistant With Status Migrainosus,0,377844,"OTRAS FORMAS DE MIGRAÑA, SIN MENCION DE MIGRAÑA RESISTENTE AL TRATAMIENTO, CON ESTATUS MIGRAÑOSO",0.7963452935218811,APPROVED,377844,
618.3,Full Prolapse Uterovaginal,3843,193528,PROLAPSO UTEROVAGINAL COMPLETO,0.7886486649513245,APPROVED,193528,
