cod_crg,Frequency.4,codes,spanish description,english description,comment
338,1,55853.0,Trastorno generalizado del desarrollo (autismo): Nivel 3,MYMEMORY WARNING: YOU USED ALL AVAILABLE FREE TRANSLATIONS FOR TODAY. NEXT AVAILABLE IN  09 HOURS 30 MINUTES 23 SECONDSVISIT HTTPS://MYMEMORY.TRANSLATED.NET/DOC/USAGELIMITS.PHP TO TRANSLATE MORE,
769,1,53454.0,Estenosis espinal: Nivel 4,MYMEMORY WARNING: YOU USED ALL AVAILABLE FREE TRANSLATIONS FOR TODAY. NEXT AVAILABLE IN  09 HOURS 30 MINUTES 23 SECONDSVISIT HTTPS://MYMEMORY.TRANSLATED.NET/DOC/USAGELIMITS.PHP TO TRANSLATE MORE,
811,1,51864.0,Fibrilación auricular: Nivel 4,MYMEMORY WARNING: YOU USED ALL AVAILABLE FREE TRANSLATIONS FOR TODAY. NEXT AVAILABLE IN  09 HOURS 26 MINUTES 52 SECONDSVISIT HTTPS://MYMEMORY.TRANSLATED.NET/DOC/USAGELIMITS.PHP TO TRANSLATE MORE,
920,1,70223.0,Diabetes - EPOC- Otra enfermedad crónica dominante: Nivel 3,MYMEMORY WARNING: YOU USED ALL AVAILABLE FREE TRANSLATIONS FOR TODAY. NEXT AVAILABLE IN  09 HOURS 30 MINUTES 23 SECONDSVISIT HTTPS://MYMEMORY.TRANSLATED.NET/DOC/USAGELIMITS.PHP TO TRANSLATE MORE,
398,1,54393.0,Diagnósticos endocrinos y metabólicos crónicos - Mayor: Nivel 3,MYMEMORY WARNING: YOU USED ALL AVAILABLE FREE TRANSLATIONS FOR TODAY. NEXT AVAILABLE IN  09 HOURS 30 MINUTES 23 SECONDSVISIT HTTPS://MYMEMORY.TRANSLATED.NET/DOC/USAGELIMITS.PHP TO TRANSLATE MORE,
100,1,80011.0,Neoplasias dominantes primarias múltiples: Nivel 1,MYMEMORY WARNING: YOU USED ALL AVAILABLE FREE TRANSLATIONS FOR TODAY. NEXT AVAILABLE IN  09 HOURS 30 MINUTES 23 SECONDSVISIT HTTPS://MYMEMORY.TRANSLATED.NET/DOC/USAGELIMITS.PHP TO TRANSLATE MORE,
46,1,54741.0,Estado de trasplante renal: Nivel 1,MYMEMORY WARNING: YOU USED ALL AVAILABLE FREE TRANSLATIONS FOR TODAY. NEXT AVAILABLE IN  09 HOURS 30 MINUTES 23 SECONDSVISIT HTTPS://MYMEMORY.TRANSLATED.NET/DOC/USAGELIMITS.PHP TO TRANSLATE MORE,
445,1,56051.0,Enfermedades inmunes y leucocitarias: Nivel 1,MYMEMORY WARNING: YOU USED ALL AVAILABLE FREE TRANSLATIONS FOR TODAY. NEXT AVAILABLE IN  09 HOURS 30 MINUTES 23 SECONDSVISIT HTTPS://MYMEMORY.TRANSLATED.NET/DOC/USAGELIMITS.PHP TO TRANSLATE MORE,
413,1,35571.0,"Prematuridad, peso al nacer inferior a 1000 g: Nivel 1",MYMEMORY WARNING: YOU USED ALL AVAILABLE FREE TRANSLATIONS FOR TODAY. NEXT AVAILABLE IN  09 HOURS 26 MINUTES 51 SECONDSVISIT HTTPS://MYMEMORY.TRANSLATED.NET/DOC/USAGELIMITS.PHP TO TRANSLATE MORE,
514,1,90403.0,Nutrición parenteral total: Nivel 3,MYMEMORY WARNING: YOU USED ALL AVAILABLE FREE TRANSLATIONS FOR TODAY. NEXT AVAILABLE IN  09 HOURS 26 MINUTES 51 SECONDSVISIT HTTPS://MYMEMORY.TRANSLATED.NET/DOC/USAGELIMITS.PHP TO TRANSLATE MORE,
269,1,70303.0,EPOC - Enfermedad coronaria avanzada - Otra enfermedad crónica dominante: Nivel 3,MYMEMORY WARNING: YOU USED ALL AVAILABLE FREE TRANSLATIONS FOR TODAY. NEXT AVAILABLE IN  09 HOURS 30 MINUTES 22 SECONDSVISIT HTTPS://MYMEMORY.TRANSLATED.NET/DOC/USAGELIMITS.PHP TO TRANSLATE MORE,
953,1,70701.0,Diabetes - Enfermedad cerebrovascular - Hipertensión: Nivel 1,MYMEMORY WARNING: YOU USED ALL AVAILABLE FREE TRANSLATIONS FOR TODAY. NEXT AVAILABLE IN  09 HOURS 26 MINUTES 51 SECONDSVISIT HTTPS://MYMEMORY.TRANSLATED.NET/DOC/USAGELIMITS.PHP TO TRANSLATE MORE,
39,1,61305.0,Enfermedad cerebrovascular y diabetes,MYMEMORY WARNING: YOU USED ALL AVAILABLE FREE TRANSLATIONS FOR TODAY. NEXT AVAILABLE IN  09 HOURS 30 MINUTES 22 SECONDSVISIT HTTPS://MYMEMORY.TRANSLATED.NET/DOC/USAGELIMITS.PHP TO TRANSLATE MORE,
1013,1,62405.0,Otra enfermedad dominante crónica y asma: Nivel 5,MYMEMORY WARNING: YOU USED ALL AVAILABLE FREE TRANSLATIONS FOR TODAY. NEXT AVAILABLE IN  09 HOURS 30 MINUTES 22 SECONDSVISIT HTTPS://MYMEMORY.TRANSLATED.NET/DOC/USAGELIMITS.PHP TO TRANSLATE MORE,
234,1,70502.0,Enfermedad cerebrovascular -Dos o más enfermedades crónicas dominantes: Nivel 2,MYMEMORY WARNING: YOU USED ALL AVAILABLE FREE TRANSLATIONS FOR TODAY. NEXT AVAILABLE IN  09 HOURS 30 MINUTES 22 SECONDSVISIT HTTPS://MYMEMORY.TRANSLATED.NET/DOC/USAGELIMITS.PHP TO TRANSLATE MORE,
32,1,51811.0,Enfermedades valvulares: Nivel 1,MYMEMORY WARNING: YOU USED ALL AVAILABLE FREE TRANSLATIONS FOR TODAY. NEXT AVAILABLE IN  09 HOURS 30 MINUTES 22 SECONDSVISIT HTTPS://MYMEMORY.TRANSLATED.NET/DOC/USAGELIMITS.PHP TO TRANSLATE MORE,
661,1,61006.0,Insuficiencia renal crónica y otras enfermedades crónicas dominantes o moderadas: Nivel 6,MYMEMORY WARNING: YOU USED ALL AVAILABLE FREE TRANSLATIONS FOR TODAY. NEXT AVAILABLE IN  09 HOURS 30 MINUTES 22 SECONDSVISIT HTTPS://MYMEMORY.TRANSLATED.NET/DOC/USAGELIMITS.PHP TO TRANSLATE MORE,
330,1,61161.0,Insuficiencia cardiaca y otra enfermedad moderada crónica: Nivel 1,MYMEMORY WARNING: YOU USED ALL AVAILABLE FREE TRANSLATIONS FOR TODAY. NEXT AVAILABLE IN  09 HOURS 30 MINUTES 22 SECONDSVISIT HTTPS://MYMEMORY.TRANSLATED.NET/DOC/USAGELIMITS.PHP TO TRANSLATE MORE,
1038,1,86654.0,Linfoma no Hodgkin: Nivel 4,MYMEMORY WARNING: YOU USED ALL AVAILABLE FREE TRANSLATIONS FOR TODAY. NEXT AVAILABLE IN  09 HOURS 30 MINUTES 22 SECONDSVISIT HTTPS://MYMEMORY.TRANSLATED.NET/DOC/USAGELIMITS.PHP TO TRANSLATE MORE,
728,1,62801.0,"Neoplasia de mama y otra enfermedad crónica, Nivel 2: Nivel 1",MYMEMORY WARNING: YOU USED ALL AVAILABLE FREE TRANSLATIONS FOR TODAY. NEXT AVAILABLE IN  09 HOURS 30 MINUTES 22 SECONDSVISIT HTTPS://MYMEMORY.TRANSLATED.NET/DOC/USAGELIMITS.PHP TO TRANSLATE MORE,
241,1,61174.0,"Insuficiencia cardiaca y otra enfermedad crónica, Nivel 2: Nivel 4",MYMEMORY WARNING: YOU USED ALL AVAILABLE FREE TRANSLATIONS FOR TODAY. NEXT AVAILABLE IN  09 HOURS 30 MINUTES 22 SECONDSVISIT HTTPS://MYMEMORY.TRANSLATED.NET/DOC/USAGELIMITS.PHP TO TRANSLATE MORE,
694,1,62004.0,Otra enfermedad dominante crónica y enfermedad psiquiátrica (excepto esquizofrenia): Nivel 4,MYMEMORY WARNING: YOU USED ALL AVAILABLE FREE TRANSLATIONS FOR TODAY. NEXT AVAILABLE IN  09 HOURS 30 MINUTES 21 SECONDSVISIT HTTPS://MYMEMORY.TRANSLATED.NET/DOC/USAGELIMITS.PHP TO TRANSLATE MORE,
451,1,54391.0,Diagnósticos endocrinos y metabólicos crónicos - Mayor: Nivel 1,MYMEMORY WARNING: YOU USED ALL AVAILABLE FREE TRANSLATIONS FOR TODAY. NEXT AVAILABLE IN  09 HOURS 30 MINUTES 21 SECONDSVISIT HTTPS://MYMEMORY.TRANSLATED.NET/DOC/USAGELIMITS.PHP TO TRANSLATE MORE,
831,1,20100.0,Dos o más enfermedades agudas significativas de diferentes CDMs excluyendo ORL,MYMEMORY WARNING: YOU USED ALL AVAILABLE FREE TRANSLATIONS FOR TODAY. NEXT AVAILABLE IN  09 HOURS 30 MINUTES 21 SECONDSVISIT HTTPS://MYMEMORY.TRANSLATED.NET/DOC/USAGELIMITS.PHP TO TRANSLATE MORE,
406,1,62911.0,"Asma y otra enfermedad crónica, Nivel 2: Nivel 1",MYMEMORY WARNING: YOU USED ALL AVAILABLE FREE TRANSLATIONS FOR TODAY. NEXT AVAILABLE IN  09 HOURS 30 MINUTES 21 SECONDSVISIT HTTPS://MYMEMORY.TRANSLATED.NET/DOC/USAGELIMITS.PHP TO TRANSLATE MORE,
828,1,35111.0,"Enfermedad prostática, infertilidad y neoplasias benignas, varones: Nivel 1",MYMEMORY WARNING: YOU USED ALL AVAILABLE FREE TRANSLATIONS FOR TODAY. NEXT AVAILABLE IN  09 HOURS 30 MINUTES 21 SECONDSVISIT HTTPS://MYMEMORY.TRANSLATED.NET/DOC/USAGELIMITS.PHP TO TRANSLATE MORE,
569,1,80012.0,Neoplasias dominantes primarias múltiples: Nivel 2,MYMEMORY WARNING: YOU USED ALL AVAILABLE FREE TRANSLATIONS FOR TODAY. NEXT AVAILABLE IN  09 HOURS 30 MINUTES 21 SECONDSVISIT HTTPS://MYMEMORY.TRANSLATED.NET/DOC/USAGELIMITS.PHP TO TRANSLATE MORE,
606,1,86501.0,Neoplasia de ovario: Nivel 1,MYMEMORY WARNING: YOU USED ALL AVAILABLE FREE TRANSLATIONS FOR TODAY. NEXT AVAILABLE IN  09 HOURS 30 MINUTES 21 SECONDSVISIT HTTPS://MYMEMORY.TRANSLATED.NET/DOC/USAGELIMITS.PHP TO TRANSLATE MORE,
144,1,61614.0,Demencia y otra enfermedad moderada crónica: Nivel 4,MYMEMORY WARNING: YOU USED ALL AVAILABLE FREE TRANSLATIONS FOR TODAY. NEXT AVAILABLE IN  09 HOURS 30 MINUTES 21 SECONDSVISIT HTTPS://MYMEMORY.TRANSLATED.NET/DOC/USAGELIMITS.PHP TO TRANSLATE MORE,
896,1,55851.0,Trastorno generalizado del desarrollo (autismo): Nivel 1,MYMEMORY WARNING: YOU USED ALL AVAILABLE FREE TRANSLATIONS FOR TODAY. NEXT AVAILABLE IN  09 HOURS 30 MINUTES 21 SECONDSVISIT HTTPS://MYMEMORY.TRANSLATED.NET/DOC/USAGELIMITS.PHP TO TRANSLATE MORE,
740,1,33562.0,Dolor crónico: Nivel 2,MYMEMORY WARNING: YOU USED ALL AVAILABLE FREE TRANSLATIONS FOR TODAY. NEXT AVAILABLE IN  09 HOURS 30 MINUTES 20 SECONDSVISIT HTTPS://MYMEMORY.TRANSLATED.NET/DOC/USAGELIMITS.PHP TO TRANSLATE MORE,
1054,1,62505.0,Otra enfermedad dominante crónica y abuso de drogas crónico moderado: Nivel 5,MYMEMORY WARNING: YOU USED ALL AVAILABLE FREE TRANSLATIONS FOR TODAY. NEXT AVAILABLE IN  09 HOURS 30 MINUTES 20 SECONDSVISIT HTTPS://MYMEMORY.TRANSLATED.NET/DOC/USAGELIMITS.PHP TO TRANSLATE MORE,
308,1,70024.0,Insuficiencia renal crónica - Dos o más enfermedades crónicas dominantes: Nivel 4,MYMEMORY WARNING: YOU USED ALL AVAILABLE FREE TRANSLATIONS FOR TODAY. NEXT AVAILABLE IN  09 HOURS 30 MINUTES 20 SECONDSVISIT HTTPS://MYMEMORY.TRANSLATED.NET/DOC/USAGELIMITS.PHP TO TRANSLATE MORE,
244,1,50741.0,Degeneración macular: Nivel 1,MYMEMORY WARNING: YOU USED ALL AVAILABLE FREE TRANSLATIONS FOR TODAY. NEXT AVAILABLE IN  09 HOURS 30 MINUTES 20 SECONDSVISIT HTTPS://MYMEMORY.TRANSLATED.NET/DOC/USAGELIMITS.PHP TO TRANSLATE MORE,
599,1,50751.0,"Ceguera, pérdida de visión y diagnósticos oculares crónicos -Mayor/moderado: Nivel 1",MYMEMORY WARNING: YOU USED ALL AVAILABLE FREE TRANSLATIONS FOR TODAY. NEXT AVAILABLE IN  09 HOURS 30 MINUTES 20 SECONDSVISIT HTTPS://MYMEMORY.TRANSLATED.NET/DOC/USAGELIMITS.PHP TO TRANSLATE MORE,
924,1,50113.0,Diagnósticos neuromusculares crónicos/Otros diagnósticos neurológicos - Moderado: Nivel 3,MYMEMORY WARNING: YOU USED ALL AVAILABLE FREE TRANSLATIONS FOR TODAY. NEXT AVAILABLE IN  09 HOURS 26 MINUTES 49 SECONDSVISIT HTTPS://MYMEMORY.TRANSLATED.NET/DOC/USAGELIMITS.PHP TO TRANSLATE MORE,
752,1,50123.0,Historia de accidente isquémico transitorio: Nivel 3,MYMEMORY WARNING: YOU USED ALL AVAILABLE FREE TRANSLATIONS FOR TODAY. NEXT AVAILABLE IN  09 HOURS 30 MINUTES 20 SECONDSVISIT HTTPS://MYMEMORY.TRANSLATED.NET/DOC/USAGELIMITS.PHP TO TRANSLATE MORE,
849,1,53433.0,"Diagnósticos congénitos mayores de hueso, cartílago y músculo: Nivel 3",MYMEMORY WARNING: YOU USED ALL AVAILABLE FREE TRANSLATIONS FOR TODAY. NEXT AVAILABLE IN  09 HOURS 30 MINUTES 20 SECONDSVISIT HTTPS://MYMEMORY.TRANSLATED.NET/DOC/USAGELIMITS.PHP TO TRANSLATE MORE,
868,1,70713.0,Diabetes - Hipertensión - Otra enfermedad crónica dominante: Nivel 3,MYMEMORY WARNING: YOU USED ALL AVAILABLE FREE TRANSLATIONS FOR TODAY. NEXT AVAILABLE IN  09 HOURS 30 MINUTES 20 SECONDSVISIT HTTPS://MYMEMORY.TRANSLATED.NET/DOC/USAGELIMITS.PHP TO TRANSLATE MORE,
472,1,61904.0,Otras dos enfermedades dominantes crónicas: Nivel 4,MYMEMORY WARNING: YOU USED ALL AVAILABLE FREE TRANSLATIONS FOR TODAY. NEXT AVAILABLE IN  09 HOURS 30 MINUTES 20 SECONDSVISIT HTTPS://MYMEMORY.TRANSLATED.NET/DOC/USAGELIMITS.PHP TO TRANSLATE MORE,
871,1,51204.0,Labio leporino y paladar hendido: Nivel 4,MYMEMORY WARNING: YOU USED ALL AVAILABLE FREE TRANSLATIONS FOR TODAY. NEXT AVAILABLE IN  09 HOURS 30 MINUTES 20 SECONDSVISIT HTTPS://MYMEMORY.TRANSLATED.NET/DOC/USAGELIMITS.PHP TO TRANSLATE MORE,
602,1,86651.0,Linfoma no Hodgkin: Nivel 1,MYMEMORY WARNING: YOU USED ALL AVAILABLE FREE TRANSLATIONS FOR TODAY. NEXT AVAILABLE IN  09 HOURS 30 MINUTES 19 SECONDSVISIT HTTPS://MYMEMORY.TRANSLATED.NET/DOC/USAGELIMITS.PHP TO TRANSLATE MORE,
497,1,86523.0,Leucemia linfática crónica: Nivel 3,MYMEMORY WARNING: YOU USED ALL AVAILABLE FREE TRANSLATIONS FOR TODAY. NEXT AVAILABLE IN  09 HOURS 26 MINUTES 48 SECONDSVISIT HTTPS://MYMEMORY.TRANSLATED.NET/DOC/USAGELIMITS.PHP TO TRANSLATE MORE,
105,1,34831.0,Infecciones recurrentes del tracto urinario: Nivel 1,MYMEMORY WARNING: YOU USED ALL AVAILABLE FREE TRANSLATIONS FOR TODAY. NEXT AVAILABLE IN  09 HOURS 26 MINUTES 48 SECONDSVISIT HTTPS://MYMEMORY.TRANSLATED.NET/DOC/USAGELIMITS.PHP TO TRANSLATE MORE,
952,1,61605.0,Demencia y otra enfermedad dominante crónica: Nivel 5,MYMEMORY WARNING: YOU USED ALL AVAILABLE FREE TRANSLATIONS FOR TODAY. NEXT AVAILABLE IN  09 HOURS 30 MINUTES 19 SECONDSVISIT HTTPS://MYMEMORY.TRANSLATED.NET/DOC/USAGELIMITS.PHP TO TRANSLATE MORE,
1029,1,51783.0,Otros diagnósticos cardiacos congénitos mayores excepto valvulares: Nivel 3,MYMEMORY WARNING: YOU USED ALL AVAILABLE FREE TRANSLATIONS FOR TODAY. NEXT AVAILABLE IN  09 HOURS 30 MINUTES 19 SECONDSVISIT HTTPS://MYMEMORY.TRANSLATED.NET/DOC/USAGELIMITS.PHP TO TRANSLATE MORE,
256,1,62934.0,"Otra enfermedad dominante crónica y otra enfermedad crónica, Nivel 2: Nivel 4",MYMEMORY WARNING: YOU USED ALL AVAILABLE FREE TRANSLATIONS FOR TODAY. NEXT AVAILABLE IN  09 HOURS 26 MINUTES 48 SECONDSVISIT HTTPS://MYMEMORY.TRANSLATED.NET/DOC/USAGELIMITS.PHP TO TRANSLATE MORE,
331,1,50114.0,Diagnósticos neuromusculares crónicos/Otros diagnósticos neurológicos - Moderado: Nivel 4,MYMEMORY WARNING: YOU USED ALL AVAILABLE FREE TRANSLATIONS FOR TODAY. NEXT AVAILABLE IN  09 HOURS 26 MINUTES 47 SECONDSVISIT HTTPS://MYMEMORY.TRANSLATED.NET/DOC/USAGELIMITS.PHP TO TRANSLATE MORE,
573,1,70504.0,Enfermedad cerebrovascular -Dos o más enfermedades crónicas dominantes: Nivel 4,MYMEMORY WARNING: YOU USED ALL AVAILABLE FREE TRANSLATIONS FOR TODAY. NEXT AVAILABLE IN  09 HOURS 30 MINUTES 19 SECONDSVISIT HTTPS://MYMEMORY.TRANSLATED.NET/DOC/USAGELIMITS.PHP TO TRANSLATE MORE,
124,1,52373.0,Enfermedades arteriales y venosas crónicas - mayor: Nivel 3,MYMEMORY WARNING: YOU USED ALL AVAILABLE FREE TRANSLATIONS FOR TODAY. NEXT AVAILABLE IN  09 HOURS 30 MINUTES 19 SECONDSVISIT HTTPS://MYMEMORY.TRANSLATED.NET/DOC/USAGELIMITS.PHP TO TRANSLATE MORE,
334,1,10000.0,Estado sano,MYMEMORY WARNING: YOU USED ALL AVAILABLE FREE TRANSLATIONS FOR TODAY. NEXT AVAILABLE IN  09 HOURS 30 MINUTES 19 SECONDSVISIT HTTPS://MYMEMORY.TRANSLATED.NET/DOC/USAGELIMITS.PHP TO TRANSLATE MORE,
396,1,51834.0,Angina y cardiipatía isquémica: Nivel 4,MYMEMORY WARNING: YOU USED ALL AVAILABLE FREE TRANSLATIONS FOR TODAY. NEXT AVAILABLE IN  09 HOURS 30 MINUTES 18 SECONDSVISIT HTTPS://MYMEMORY.TRANSLATED.NET/DOC/USAGELIMITS.PHP TO TRANSLATE MORE,
279,1,62701.0,Otras dos enfermedades crónicas moderadas: Nivel 1,MYMEMORY WARNING: YOU USED ALL AVAILABLE FREE TRANSLATIONS FOR TODAY. NEXT AVAILABLE IN  09 HOURS 26 MINUTES 47 SECONDSVISIT HTTPS://MYMEMORY.TRANSLATED.NET/DOC/USAGELIMITS.PHP TO TRANSLATE MORE,
243,1,61142.0,Insuficiencia cardiaca y otra enfermedad dominante crónica: Nivel 2,MYMEMORY WARNING: YOU USED ALL AVAILABLE FREE TRANSLATIONS FOR TODAY. NEXT AVAILABLE IN  09 HOURS 26 MINUTES 47 SECONDSVISIT HTTPS://MYMEMORY.TRANSLATED.NET/DOC/USAGELIMITS.PHP TO TRANSLATE MORE,
1071,1,50104.0,Hidrocefalia y otras anomalías cerebrales: Nivel 4,MYMEMORY WARNING: YOU USED ALL AVAILABLE FREE TRANSLATIONS FOR TODAY. NEXT AVAILABLE IN  09 HOURS 30 MINUTES 18 SECONDSVISIT HTTPS://MYMEMORY.TRANSLATED.NET/DOC/USAGELIMITS.PHP TO TRANSLATE MORE,
848,1,53432.0,"Diagnósticos congénitos mayores de hueso, cartílago y músculo: Nivel 2",MYMEMORY WARNING: YOU USED ALL AVAILABLE FREE TRANSLATIONS FOR TODAY. NEXT AVAILABLE IN  09 HOURS 30 MINUTES 18 SECONDSVISIT HTTPS://MYMEMORY.TRANSLATED.NET/DOC/USAGELIMITS.PHP TO TRANSLATE MORE,
481,1,54394.0,Diagnósticos endocrinos y metabólicos crónicos - Mayor: Nivel 4,MYMEMORY WARNING: YOU USED ALL AVAILABLE FREE TRANSLATIONS FOR TODAY. NEXT AVAILABLE IN  09 HOURS 30 MINUTES 18 SECONDSVISIT HTTPS://MYMEMORY.TRANSLATED.NET/DOC/USAGELIMITS.PHP TO TRANSLATE MORE,
608,1,31422.0,Otros diagnósticos pulmonares crónicos: Nivel 2,MYMEMORY WARNING: YOU USED ALL AVAILABLE FREE TRANSLATIONS FOR TODAY. NEXT AVAILABLE IN  09 HOURS 30 MINUTES 18 SECONDSVISIT HTTPS://MYMEMORY.TRANSLATED.NET/DOC/USAGELIMITS.PHP TO TRANSLATE MORE,
1073,1,70606.0,Tres o más enfermedades crónicas dominantes: Nivel 6,MYMEMORY WARNING: YOU USED ALL AVAILABLE FREE TRANSLATIONS FOR TODAY. NEXT AVAILABLE IN  09 HOURS 26 MINUTES 46 SECONDSVISIT HTTPS://MYMEMORY.TRANSLATED.NET/DOC/USAGELIMITS.PHP TO TRANSLATE MORE,
1047,1,61521.0,"Enfermedad coronaria avanzada y otra enfermedad crónica, Nivel 2: Nivel 1",MYMEMORY WARNING: YOU USED ALL AVAILABLE FREE TRANSLATIONS FOR TODAY. NEXT AVAILABLE IN  09 HOURS 30 MINUTES 18 SECONDSVISIT HTTPS://MYMEMORY.TRANSLATED.NET/DOC/USAGELIMITS.PHP TO TRANSLATE MORE,
713,1,62406.0,Otra enfermedad dominante crónica y asma: Nivel 6,MYMEMORY WARNING: YOU USED ALL AVAILABLE FREE TRANSLATIONS FOR TODAY. NEXT AVAILABLE IN  09 HOURS 30 MINUTES 18 SECONDSVISIT HTTPS://MYMEMORY.TRANSLATED.NET/DOC/USAGELIMITS.PHP TO TRANSLATE MORE,
579,1,10060.0,Diagnósticos de problema neonatal o congénito mayor sin otra enfermedad significativa,MYMEMORY WARNING: YOU USED ALL AVAILABLE FREE TRANSLATIONS FOR TODAY. NEXT AVAILABLE IN  09 HOURS 30 MINUTES 17 SECONDSVISIT HTTPS://MYMEMORY.TRANSLATED.NET/DOC/USAGELIMITS.PHP TO TRANSLATE MORE,
1045,1,20790.0,Diagnósticos catastróficos con otra enfermedad significativa,MYMEMORY WARNING: YOU USED ALL AVAILABLE FREE TRANSLATIONS FOR TODAY. NEXT AVAILABLE IN  09 HOURS 30 MINUTES 17 SECONDSVISIT HTTPS://MYMEMORY.TRANSLATED.NET/DOC/USAGELIMITS.PHP TO TRANSLATE MORE,
770,1,54784.0,Anomalías de riñón o tracto urinario: Nivel 4,MYMEMORY WARNING: YOU USED ALL AVAILABLE FREE TRANSLATIONS FOR TODAY. NEXT AVAILABLE IN  09 HOURS 30 MINUTES 17 SECONDSVISIT HTTPS://MYMEMORY.TRANSLATED.NET/DOC/USAGELIMITS.PHP TO TRANSLATE MORE,
583,1,61616.0,Demencia y otra enfermedad moderada crónica: Nivel 6,MYMEMORY WARNING: YOU USED ALL AVAILABLE FREE TRANSLATIONS FOR TODAY. NEXT AVAILABLE IN  09 HOURS 30 MINUTES 17 SECONDSVISIT HTTPS://MYMEMORY.TRANSLATED.NET/DOC/USAGELIMITS.PHP TO TRANSLATE MORE,
59,1,61721.0,"Esquizofrenia y otra enfermedad crónica, Nivel 2: Nivel 1",MYMEMORY WARNING: YOU USED ALL AVAILABLE FREE TRANSLATIONS FOR TODAY. NEXT AVAILABLE IN  09 HOURS 30 MINUTES 17 SECONDSVISIT HTTPS://MYMEMORY.TRANSLATED.NET/DOC/USAGELIMITS.PHP TO TRANSLATE MORE,
677,1,86613.0,Neoplasia de proteinas plasmáticas: Nivel 3,MYMEMORY WARNING: YOU USED ALL AVAILABLE FREE TRANSLATIONS FOR TODAY. NEXT AVAILABLE IN  09 HOURS 30 MINUTES 17 SECONDSVISIT HTTPS://MYMEMORY.TRANSLATED.NET/DOC/USAGELIMITS.PHP TO TRANSLATE MORE,
571,1,35232.0,Enfermedad inflamatoria crónica pélvica: Nivel 2,MYMEMORY WARNING: YOU USED ALL AVAILABLE FREE TRANSLATIONS FOR TODAY. NEXT AVAILABLE IN  09 HOURS 30 MINUTES 17 SECONDSVISIT HTTPS://MYMEMORY.TRANSLATED.NET/DOC/USAGELIMITS.PHP TO TRANSLATE MORE,
454,1,70305.0,EPOC - Enfermedad coronaria avanzada - Otra enfermedad crónica dominante: Nivel 5,MYMEMORY WARNING: YOU USED ALL AVAILABLE FREE TRANSLATIONS FOR TODAY. NEXT AVAILABLE IN  09 HOURS 26 MINUTES 45 SECONDSVISIT HTTPS://MYMEMORY.TRANSLATED.NET/DOC/USAGELIMITS.PHP TO TRANSLATE MORE,
494,1,70401.0,Enfermedad coronaria avanzada -Enfermedad vascular periférica - Otra enfermedad crónica dominante: Nivel 1,MYMEMORY WARNING: YOU USED ALL AVAILABLE FREE TRANSLATIONS FOR TODAY. NEXT AVAILABLE IN  09 HOURS 26 MINUTES 45 SECONDSVISIT HTTPS://MYMEMORY.TRANSLATED.NET/DOC/USAGELIMITS.PHP TO TRANSLATE MORE,
357,1,30781.0,Glaucoma: Nivel 1,MYMEMORY WARNING: YOU USED ALL AVAILABLE FREE TRANSLATIONS FOR TODAY. NEXT AVAILABLE IN  09 HOURS 30 MINUTES 17 SECONDSVISIT HTTPS://MYMEMORY.TRANSLATED.NET/DOC/USAGELIMITS.PHP TO TRANSLATE MORE,
260,1,70145.0,Insuficiencia cardiaca - Enfermedad vascular periférica - Otra enfermedad crónica dominante: Nivel 5,MYMEMORY WARNING: YOU USED ALL AVAILABLE FREE TRANSLATIONS FOR TODAY. NEXT AVAILABLE IN  09 HOURS 30 MINUTES 17 SECONDSVISIT HTTPS://MYMEMORY.TRANSLATED.NET/DOC/USAGELIMITS.PHP TO TRANSLATE MORE,
119,1,50122.0,Historia de accidente isquémico transitorio: Nivel 2,MYMEMORY WARNING: YOU USED ALL AVAILABLE FREE TRANSLATIONS FOR TODAY. NEXT AVAILABLE IN  09 HOURS 30 MINUTES 16 SECONDSVISIT HTTPS://MYMEMORY.TRANSLATED.NET/DOC/USAGELIMITS.PHP TO TRANSLATE MORE,
956,1,61165.0,Insuficiencia cardiaca y otra enfermedad moderada crónica: Nivel 5,MYMEMORY WARNING: YOU USED ALL AVAILABLE FREE TRANSLATIONS FOR TODAY. NEXT AVAILABLE IN  09 HOURS 30 MINUTES 16 SECONDSVISIT HTTPS://MYMEMORY.TRANSLATED.NET/DOC/USAGELIMITS.PHP TO TRANSLATE MORE,
560,1,56103.0,Diagnósticos hematológicos crónicos e inmunes - Moderado: Nivel 3,MYMEMORY WARNING: YOU USED ALL AVAILABLE FREE TRANSLATIONS FOR TODAY. NEXT AVAILABLE IN  09 HOURS 30 MINUTES 16 SECONDSVISIT HTTPS://MYMEMORY.TRANSLATED.NET/DOC/USAGELIMITS.PHP TO TRANSLATE MORE,
428,1,61326.0,Enfermedad cerebrovascular y otra enfermedad moderada crónica,MYMEMORY WARNING: YOU USED ALL AVAILABLE FREE TRANSLATIONS FOR TODAY. NEXT AVAILABLE IN  09 HOURS 30 MINUTES 16 SECONDSVISIT HTTPS://MYMEMORY.TRANSLATED.NET/DOC/USAGELIMITS.PHP TO TRANSLATE MORE,
299,1,61131.0,Insuficiencia cardiaca y enfermedad cerebrovascular: Nivel 1,MYMEMORY WARNING: YOU USED ALL AVAILABLE FREE TRANSLATIONS FOR TODAY. NEXT AVAILABLE IN  09 HOURS 26 MINUTES 45 SECONDSVISIT HTTPS://MYMEMORY.TRANSLATED.NET/DOC/USAGELIMITS.PHP TO TRANSLATE MORE,
343,1,52411.0,Varices en piernas con úlceras o inflamación: Nivel 1,MYMEMORY WARNING: YOU USED ALL AVAILABLE FREE TRANSLATIONS FOR TODAY. NEXT AVAILABLE IN  09 HOURS 30 MINUTES 16 SECONDSVISIT HTTPS://MYMEMORY.TRANSLATED.NET/DOC/USAGELIMITS.PHP TO TRANSLATE MORE,
1079,1,31962.0,Diagnósticos cardiovasculares crónicos - menor: Nivel 2,MYMEMORY WARNING: YOU USED ALL AVAILABLE FREE TRANSLATIONS FOR TODAY. NEXT AVAILABLE IN  09 HOURS 30 MINUTES 16 SECONDSVISIT HTTPS://MYMEMORY.TRANSLATED.NET/DOC/USAGELIMITS.PHP TO TRANSLATE MORE,
979,1,62312.0,Otra neoplasia no dominante y otra enfermedad moderada crónica: Nivel 2,MYMEMORY WARNING: YOU USED ALL AVAILABLE FREE TRANSLATIONS FOR TODAY. NEXT AVAILABLE IN  09 HOURS 30 MINUTES 16 SECONDSVISIT HTTPS://MYMEMORY.TRANSLATED.NET/DOC/USAGELIMITS.PHP TO TRANSLATE MORE,
990,1,70015.0,Insuficiencia renal crónica - Otra enfermedad crónica dominante: Nivel 5,MYMEMORY WARNING: YOU USED ALL AVAILABLE FREE TRANSLATIONS FOR TODAY. NEXT AVAILABLE IN  09 HOURS 26 MINUTES 44 SECONDSVISIT HTTPS://MYMEMORY.TRANSLATED.NET/DOC/USAGELIMITS.PHP TO TRANSLATE MORE,
325,1,61311.0,Enfermedad cerebrovascular y otra enfermedad dominante crónica,MYMEMORY WARNING: YOU USED ALL AVAILABLE FREE TRANSLATIONS FOR TODAY. NEXT AVAILABLE IN  09 HOURS 30 MINUTES 16 SECONDSVISIT HTTPS://MYMEMORY.TRANSLATED.NET/DOC/USAGELIMITS.PHP TO TRANSLATE MORE,
759,1,32742.0,Diagnósticos gastrointestinales crónicos - menor: Nivel 2,MYMEMORY WARNING: YOU USED ALL AVAILABLE FREE TRANSLATIONS FOR TODAY. NEXT AVAILABLE IN  09 HOURS 30 MINUTES 15 SECONDSVISIT HTTPS://MYMEMORY.TRANSLATED.NET/DOC/USAGELIMITS.PHP TO TRANSLATE MORE,
395,1,70113.0,Insuficiencia cardiaca - Diabetes - Enfermedad cerebrovascular: Nivel 3,MYMEMORY WARNING: YOU USED ALL AVAILABLE FREE TRANSLATIONS FOR TODAY. NEXT AVAILABLE IN  09 HOURS 30 MINUTES 15 SECONDSVISIT HTTPS://MYMEMORY.TRANSLATED.NET/DOC/USAGELIMITS.PHP TO TRANSLATE MORE,
1005,1,51921.0,Hipertensión: Nivel 1,MYMEMORY WARNING: YOU USED ALL AVAILABLE FREE TRANSLATIONS FOR TODAY. NEXT AVAILABLE IN  09 HOURS 30 MINUTES 15 SECONDSVISIT HTTPS://MYMEMORY.TRANSLATED.NET/DOC/USAGELIMITS.PHP TO TRANSLATE MORE,
935,1,61902.0,Otras dos enfermedades dominantes crónicas: Nivel 2,MYMEMORY WARNING: YOU USED ALL AVAILABLE FREE TRANSLATIONS FOR TODAY. NEXT AVAILABLE IN  09 HOURS 30 MINUTES 15 SECONDSVISIT HTTPS://MYMEMORY.TRANSLATED.NET/DOC/USAGELIMITS.PHP TO TRANSLATE MORE,
19,1,70714.0,Diabetes - Hipertensión - Otra enfermedad crónica dominante: Nivel 4,MYMEMORY WARNING: YOU USED ALL AVAILABLE FREE TRANSLATIONS FOR TODAY. NEXT AVAILABLE IN  09 HOURS 30 MINUTES 15 SECONDSVISIT HTTPS://MYMEMORY.TRANSLATED.NET/DOC/USAGELIMITS.PHP TO TRANSLATE MORE,
655,1,57861.0,Abuso de drogas - Cannabis/NOS/NEC: Nivel 1,MYMEMORY WARNING: YOU USED ALL AVAILABLE FREE TRANSLATIONS FOR TODAY. NEXT AVAILABLE IN  09 HOURS 30 MINUTES 15 SECONDSVISIT HTTPS://MYMEMORY.TRANSLATED.NET/DOC/USAGELIMITS.PHP TO TRANSLATE MORE,
200,1,20850.0,"Diagnósticos gastrointestinales, hepáticos, renales o de hernia significativos con otra enfermedad significativa",MYMEMORY WARNING: YOU USED ALL AVAILABLE FREE TRANSLATIONS FOR TODAY. NEXT AVAILABLE IN  09 HOURS 30 MINUTES 15 SECONDSVISIT HTTPS://MYMEMORY.TRANSLATED.NET/DOC/USAGELIMITS.PHP TO TRANSLATE MORE,
927,1,52691.0,Anomalías gastrointestinales: Nivel 1,MYMEMORY WARNING: YOU USED ALL AVAILABLE FREE TRANSLATIONS FOR TODAY. NEXT AVAILABLE IN  09 HOURS 26 MINUTES 43 SECONDSVISIT HTTPS://MYMEMORY.TRANSLATED.NET/DOC/USAGELIMITS.PHP TO TRANSLATE MORE,
143,1,54734.0,Insuficiencia renal crónica: Nivel 4,MYMEMORY WARNING: YOU USED ALL AVAILABLE FREE TRANSLATIONS FOR TODAY. NEXT AVAILABLE IN  09 HOURS 30 MINUTES 15 SECONDSVISIT HTTPS://MYMEMORY.TRANSLATED.NET/DOC/USAGELIMITS.PHP TO TRANSLATE MORE,
293,1,10130.0,Diagnósticos de enfermedad mental mayor o abuso de drogas sin otra enfermedad significativa,MYMEMORY WARNING: YOU USED ALL AVAILABLE FREE TRANSLATIONS FOR TODAY. NEXT AVAILABLE IN  09 HOURS 30 MINUTES 15 SECONDSVISIT HTTPS://MYMEMORY.TRANSLATED.NET/DOC/USAGELIMITS.PHP TO TRANSLATE MORE,
785,1,70132.0,Insuficiencia cardiaca - EPOC - Otra enfermedad crónica dominante: Nivel 2,MYMEMORY WARNING: YOU USED ALL AVAILABLE FREE TRANSLATIONS FOR TODAY. NEXT AVAILABLE IN  09 HOURS 30 MINUTES 14 SECONDSVISIT HTTPS://MYMEMORY.TRANSLATED.NET/DOC/USAGELIMITS.PHP TO TRANSLATE MORE,
236,1,50143.0,Epilepsia: Nivel 3,MYMEMORY WARNING: YOU USED ALL AVAILABLE FREE TRANSLATIONS FOR TODAY. NEXT AVAILABLE IN  09 HOURS 30 MINUTES 14 SECONDSVISIT HTTPS://MYMEMORY.TRANSLATED.NET/DOC/USAGELIMITS.PHP TO TRANSLATE MORE,
112,1,86601.0,Linfoma de Hodgkin: Nivel 1,MYMEMORY WARNING: YOU USED ALL AVAILABLE FREE TRANSLATIONS FOR TODAY. NEXT AVAILABLE IN  09 HOURS 30 MINUTES 14 SECONDSVISIT HTTPS://MYMEMORY.TRANSLATED.NET/DOC/USAGELIMITS.PHP TO TRANSLATE MORE,
791,1,50013.0,Diagnósticos neurológicos progresivos: Nivel 3,MYMEMORY WARNING: YOU USED ALL AVAILABLE FREE TRANSLATIONS FOR TODAY. NEXT AVAILABLE IN  09 HOURS 30 MINUTES 14 SECONDSVISIT HTTPS://MYMEMORY.TRANSLATED.NET/DOC/USAGELIMITS.PHP TO TRANSLATE MORE,
