cod_crg,Frequency.4,codes,spanish description,english description,comment
555,1,62014.0,Enfermedad psiquiátrica (excepto esquizofrenia) y otra enfermedad moderada crónica: Nivel 4,MYMEMORY WARNING: YOU USED ALL AVAILABLE FREE TRANSLATIONS FOR TODAY. NEXT AVAILABLE IN  09 HOURS 30 MINUTES 05 SECONDSVISIT HTTPS://MYMEMORY.TRANSLATED.NET/DOC/USAGELIMITS.PHP TO TRANSLATE MORE,
392,1,10120.0,"Diagnósticos cardiovasculares, pulmonares u otros diagnósticos vasculares sin otra enfermedad significativa",MYMEMORY WARNING: YOU USED ALL AVAILABLE FREE TRANSLATIONS FOR TODAY. NEXT AVAILABLE IN  09 HOURS 30 MINUTES 05 SECONDSVISIT HTTPS://MYMEMORY.TRANSLATED.NET/DOC/USAGELIMITS.PHP TO TRANSLATE MORE,
633,1,61422.0,Diabetes y asma: Nivel 2,MYMEMORY WARNING: YOU USED ALL AVAILABLE FREE TRANSLATIONS FOR TODAY. NEXT AVAILABLE IN  09 HOURS 30 MINUTES 05 SECONDSVISIT HTTPS://MYMEMORY.TRANSLATED.NET/DOC/USAGELIMITS.PHP TO TRANSLATE MORE,
152,1,53481.0,Anomalía o curvatura de columna: Nivel 1,MYMEMORY WARNING: YOU USED ALL AVAILABLE FREE TRANSLATIONS FOR TODAY. NEXT AVAILABLE IN  09 HOURS 30 MINUTES 05 SECONDSVISIT HTTPS://MYMEMORY.TRANSLATED.NET/DOC/USAGELIMITS.PHP TO TRANSLATE MORE,
928,1,61162.0,Insuficiencia cardiaca y otra enfermedad moderada crónica: Nivel 2,MYMEMORY WARNING: YOU USED ALL AVAILABLE FREE TRANSLATIONS FOR TODAY. NEXT AVAILABLE IN  09 HOURS 30 MINUTES 05 SECONDSVISIT HTTPS://MYMEMORY.TRANSLATED.NET/DOC/USAGELIMITS.PHP TO TRANSLATE MORE,
283,1,54743.0,Estado de trasplante renal: Nivel 3,MYMEMORY WARNING: YOU USED ALL AVAILABLE FREE TRANSLATIONS FOR TODAY. NEXT AVAILABLE IN  09 HOURS 30 MINUTES 04 SECONDSVISIT HTTPS://MYMEMORY.TRANSLATED.NET/DOC/USAGELIMITS.PHP TO TRANSLATE MORE,
235,1,35231.0,Enfermedad inflamatoria crónica pélvica: Nivel 1,MYMEMORY WARNING: YOU USED ALL AVAILABLE FREE TRANSLATIONS FOR TODAY. NEXT AVAILABLE IN  09 HOURS 30 MINUTES 04 SECONDSVISIT HTTPS://MYMEMORY.TRANSLATED.NET/DOC/USAGELIMITS.PHP TO TRANSLATE MORE,
498,1,57833.0,Abuso de opioides: Nivel 3,MYMEMORY WARNING: YOU USED ALL AVAILABLE FREE TRANSLATIONS FOR TODAY. NEXT AVAILABLE IN  09 HOURS 30 MINUTES 04 SECONDSVISIT HTTPS://MYMEMORY.TRANSLATED.NET/DOC/USAGELIMITS.PHP TO TRANSLATE MORE,
591,1,53142.0,Trastornos pancreáticos y hepáticos crónicos - Moderado: Nivel 2,MYMEMORY WARNING: YOU USED ALL AVAILABLE FREE TRANSLATIONS FOR TODAY. NEXT AVAILABLE IN  09 HOURS 30 MINUTES 04 SECONDSVISIT HTTPS://MYMEMORY.TRANSLATED.NET/DOC/USAGELIMITS.PHP TO TRANSLATE MORE,
736,1,61316.0,Enfermedad cerebrovascular y otra enfermedad dominante crónica,MYMEMORY WARNING: YOU USED ALL AVAILABLE FREE TRANSLATIONS FOR TODAY. NEXT AVAILABLE IN  09 HOURS 26 MINUTES 33 SECONDSVISIT HTTPS://MYMEMORY.TRANSLATED.NET/DOC/USAGELIMITS.PHP TO TRANSLATE MORE,
833,1,61413.0,Diabetes y otra enfermedad dominante crónica: Nivel 3,MYMEMORY WARNING: YOU USED ALL AVAILABLE FREE TRANSLATIONS FOR TODAY. NEXT AVAILABLE IN  09 HOURS 30 MINUTES 04 SECONDSVISIT HTTPS://MYMEMORY.TRANSLATED.NET/DOC/USAGELIMITS.PHP TO TRANSLATE MORE,
823,1,55893.0,Retraso en el desarrollo NOS/NEC/Mixto: Nivel 3,MYMEMORY WARNING: YOU USED ALL AVAILABLE FREE TRANSLATIONS FOR TODAY. NEXT AVAILABLE IN  09 HOURS 26 MINUTES 33 SECONDSVISIT HTTPS://MYMEMORY.TRANSLATED.NET/DOC/USAGELIMITS.PHP TO TRANSLATE MORE,
699,1,32441.0,Diagnósticos arteriales y venosos crónicos - menor: Nivel 1,MYMEMORY WARNING: YOU USED ALL AVAILABLE FREE TRANSLATIONS FOR TODAY. NEXT AVAILABLE IN  09 HOURS 30 MINUTES 04 SECONDSVISIT HTTPS://MYMEMORY.TRANSLATED.NET/DOC/USAGELIMITS.PHP TO TRANSLATE MORE,
601,1,61454.0,"Diabetes y otra enfermedad crónica, Nivel 2: Nivel 4",MYMEMORY WARNING: YOU USED ALL AVAILABLE FREE TRANSLATIONS FOR TODAY. NEXT AVAILABLE IN  09 HOURS 30 MINUTES 04 SECONDSVISIT HTTPS://MYMEMORY.TRANSLATED.NET/DOC/USAGELIMITS.PHP TO TRANSLATE MORE,
261,1,62921.0,"Abuso de drogas crónico moderado y otra enfermedad crónica, Nivel 2: Nivel 1",MYMEMORY WARNING: YOU USED ALL AVAILABLE FREE TRANSLATIONS FOR TODAY. NEXT AVAILABLE IN  09 HOURS 26 MINUTES 32 SECONDSVISIT HTTPS://MYMEMORY.TRANSLATED.NET/DOC/USAGELIMITS.PHP TO TRANSLATE MORE,
695,1,86633.0,Neoplasia de prostata: Nivel 3,MYMEMORY WARNING: YOU USED ALL AVAILABLE FREE TRANSLATIONS FOR TODAY. NEXT AVAILABLE IN  09 HOURS 30 MINUTES 04 SECONDSVISIT HTTPS://MYMEMORY.TRANSLATED.NET/DOC/USAGELIMITS.PHP TO TRANSLATE MORE,
1094,1,57854.0,Abuso de otras sustancias significativas: Nivel 4,MYMEMORY WARNING: YOU USED ALL AVAILABLE FREE TRANSLATIONS FOR TODAY. NEXT AVAILABLE IN  09 HOURS 30 MINUTES 03 SECONDSVISIT HTTPS://MYMEMORY.TRANSLATED.NET/DOC/USAGELIMITS.PHP TO TRANSLATE MORE,
879,1,20750.0,Diagnósticos ginecológicos mayores con otra enfermedad significativa,MYMEMORY WARNING: YOU USED ALL AVAILABLE FREE TRANSLATIONS FOR TODAY. NEXT AVAILABLE IN  09 HOURS 30 MINUTES 03 SECONDSVISIT HTTPS://MYMEMORY.TRANSLATED.NET/DOC/USAGELIMITS.PHP TO TRANSLATE MORE,
685,1,56073.0,Trastornos de la coagulación: Nivel 3,MYMEMORY WARNING: YOU USED ALL AVAILABLE FREE TRANSLATIONS FOR TODAY. NEXT AVAILABLE IN  09 HOURS 26 MINUTES 32 SECONDSVISIT HTTPS://MYMEMORY.TRANSLATED.NET/DOC/USAGELIMITS.PHP TO TRANSLATE MORE,
1063,1,51173.0,Anomalías del cráneo y de los huesos faciales: Nivel 3,MYMEMORY WARNING: YOU USED ALL AVAILABLE FREE TRANSLATIONS FOR TODAY. NEXT AVAILABLE IN  09 HOURS 26 MINUTES 32 SECONDSVISIT HTTPS://MYMEMORY.TRANSLATED.NET/DOC/USAGELIMITS.PHP TO TRANSLATE MORE,
754,1,55894.0,Retraso en el desarrollo NOS/NEC/Mixto: Nivel 4,MYMEMORY WARNING: YOU USED ALL AVAILABLE FREE TRANSLATIONS FOR TODAY. NEXT AVAILABLE IN  09 HOURS 30 MINUTES 03 SECONDSVISIT HTTPS://MYMEMORY.TRANSLATED.NET/DOC/USAGELIMITS.PHP TO TRANSLATE MORE,
993,1,37572.0,Stress crónico y diagnósticos de ansiedad: Nivel 2,MYMEMORY WARNING: YOU USED ALL AVAILABLE FREE TRANSLATIONS FOR TODAY. NEXT AVAILABLE IN  09 HOURS 30 MINUTES 03 SECONDSVISIT HTTPS://MYMEMORY.TRANSLATED.NET/DOC/USAGELIMITS.PHP TO TRANSLATE MORE,
796,1,35241.0,"Infertilidad, mujer: Nivel 1",MYMEMORY WARNING: YOU USED ALL AVAILABLE FREE TRANSLATIONS FOR TODAY. NEXT AVAILABLE IN  09 HOURS 26 MINUTES 31 SECONDSVISIT HTTPS://MYMEMORY.TRANSLATED.NET/DOC/USAGELIMITS.PHP TO TRANSLATE MORE,
1033,1,86521.0,Leucemia linfática crónica: Nivel 1,MYMEMORY WARNING: YOU USED ALL AVAILABLE FREE TRANSLATIONS FOR TODAY. NEXT AVAILABLE IN  09 HOURS 30 MINUTES 03 SECONDSVISIT HTTPS://MYMEMORY.TRANSLATED.NET/DOC/USAGELIMITS.PHP TO TRANSLATE MORE,
167,1,70104.0,Insuficiencia cardiaca - Diabetes - EPOC: Nivel 4,MYMEMORY WARNING: YOU USED ALL AVAILABLE FREE TRANSLATIONS FOR TODAY. NEXT AVAILABLE IN  09 HOURS 30 MINUTES 03 SECONDSVISIT HTTPS://MYMEMORY.TRANSLATED.NET/DOC/USAGELIMITS.PHP TO TRANSLATE MORE,
496,1,20200.0,"Enfermedad aguda significativa, duración más de 90 días, excluyendo ORL",MYMEMORY WARNING: YOU USED ALL AVAILABLE FREE TRANSLATIONS FOR TODAY. NEXT AVAILABLE IN  09 HOURS 26 MINUTES 31 SECONDSVISIT HTTPS://MYMEMORY.TRANSLATED.NET/DOC/USAGELIMITS.PHP TO TRANSLATE MORE,
932,1,62012.0,Enfermedad psiquiátrica (excepto esquizofrenia) y otra enfermedad moderada crónica: Nivel 2,MYMEMORY WARNING: YOU USED ALL AVAILABLE FREE TRANSLATIONS FOR TODAY. NEXT AVAILABLE IN  09 HOURS 30 MINUTES 02 SECONDSVISIT HTTPS://MYMEMORY.TRANSLATED.NET/DOC/USAGELIMITS.PHP TO TRANSLATE MORE,
668,1,57862.0,Abuso de drogas - Cannabis/NOS/NEC: Nivel 2,MYMEMORY WARNING: YOU USED ALL AVAILABLE FREE TRANSLATIONS FOR TODAY. NEXT AVAILABLE IN  09 HOURS 30 MINUTES 02 SECONDSVISIT HTTPS://MYMEMORY.TRANSLATED.NET/DOC/USAGELIMITS.PHP TO TRANSLATE MORE,
965,1,61325.0,Enfermedad cerebrovascular y otra enfermedad moderada crónica,MYMEMORY WARNING: YOU USED ALL AVAILABLE FREE TRANSLATIONS FOR TODAY. NEXT AVAILABLE IN  09 HOURS 30 MINUTES 02 SECONDSVISIT HTTPS://MYMEMORY.TRANSLATED.NET/DOC/USAGELIMITS.PHP TO TRANSLATE MORE,
96,1,70315.0,EPOC - Dos o más enfermedades crónicas dominantes: Nivel 5,MYMEMORY WARNING: YOU USED ALL AVAILABLE FREE TRANSLATIONS FOR TODAY. NEXT AVAILABLE IN  09 HOURS 26 MINUTES 31 SECONDSVISIT HTTPS://MYMEMORY.TRANSLATED.NET/DOC/USAGELIMITS.PHP TO TRANSLATE MORE,
75,1,50063.0,Enfermedad de Alzheimer y otras demencias: Nivel 3,MYMEMORY WARNING: YOU USED ALL AVAILABLE FREE TRANSLATIONS FOR TODAY. NEXT AVAILABLE IN  09 HOURS 30 MINUTES 02 SECONDSVISIT HTTPS://MYMEMORY.TRANSLATED.NET/DOC/USAGELIMITS.PHP TO TRANSLATE MORE,
548,1,61111.0,Insuficiencia cardiaca y diabetes: Nivel 1,MYMEMORY WARNING: YOU USED ALL AVAILABLE FREE TRANSLATIONS FOR TODAY. NEXT AVAILABLE IN  09 HOURS 26 MINUTES 31 SECONDSVISIT HTTPS://MYMEMORY.TRANSLATED.NET/DOC/USAGELIMITS.PHP TO TRANSLATE MORE,
649,1,50132.0,Enfermedad cerebrovascular sin infarto: Nivel 2,MYMEMORY WARNING: YOU USED ALL AVAILABLE FREE TRANSLATIONS FOR TODAY. NEXT AVAILABLE IN  09 HOURS 30 MINUTES 02 SECONDSVISIT HTTPS://MYMEMORY.TRANSLATED.NET/DOC/USAGELIMITS.PHP TO TRANSLATE MORE,
914,1,57434.0,Esquizofrenia: Nivel 4,MYMEMORY WARNING: YOU USED ALL AVAILABLE FREE TRANSLATIONS FOR TODAY. NEXT AVAILABLE IN  09 HOURS 30 MINUTES 02 SECONDSVISIT HTTPS://MYMEMORY.TRANSLATED.NET/DOC/USAGELIMITS.PHP TO TRANSLATE MORE,
684,1,86582.0,Otras neoplasias: Nivel 2,MYMEMORY WARNING: YOU USED ALL AVAILABLE FREE TRANSLATIONS FOR TODAY. NEXT AVAILABLE IN  09 HOURS 30 MINUTES 02 SECONDSVISIT HTTPS://MYMEMORY.TRANSLATED.NET/DOC/USAGELIMITS.PHP TO TRANSLATE MORE,
1003,1,70155.0,Insuficiencia cardiaca - Enfermedad cerebrovascular - Otra enfermedad crónica dominante: Nivel 5,MYMEMORY WARNING: YOU USED ALL AVAILABLE FREE TRANSLATIONS FOR TODAY. NEXT AVAILABLE IN  09 HOURS 30 MINUTES 02 SECONDSVISIT HTTPS://MYMEMORY.TRANSLATED.NET/DOC/USAGELIMITS.PHP TO TRANSLATE MORE,
967,1,53501.0,Amputación y enfermedad ósea: Nivel 1,MYMEMORY WARNING: YOU USED ALL AVAILABLE FREE TRANSLATIONS FOR TODAY. NEXT AVAILABLE IN  09 HOURS 30 MINUTES 02 SECONDSVISIT HTTPS://MYMEMORY.TRANSLATED.NET/DOC/USAGELIMITS.PHP TO TRANSLATE MORE,
1000,1,61606.0,Demencia y otra enfermedad dominante crónica: Nivel 6,MYMEMORY WARNING: YOU USED ALL AVAILABLE FREE TRANSLATIONS FOR TODAY. NEXT AVAILABLE IN  09 HOURS 30 MINUTES 01 SECONDSVISIT HTTPS://MYMEMORY.TRANSLATED.NET/DOC/USAGELIMITS.PHP TO TRANSLATE MORE,
690,1,90604.0,Historia de trasplante orgánico mayor: Nivel 4,MYMEMORY WARNING: YOU USED ALL AVAILABLE FREE TRANSLATIONS FOR TODAY. NEXT AVAILABLE IN  09 HOURS 26 MINUTES 30 SECONDSVISIT HTTPS://MYMEMORY.TRANSLATED.NET/DOC/USAGELIMITS.PHP TO TRANSLATE MORE,
1015,1,61502.0,Enfermedad coronaria avanzada y otra enfermedad dominante crónica: Nivel 2,MYMEMORY WARNING: YOU USED ALL AVAILABLE FREE TRANSLATIONS FOR TODAY. NEXT AVAILABLE IN  09 HOURS 30 MINUTES 01 SECONDSVISIT HTTPS://MYMEMORY.TRANSLATED.NET/DOC/USAGELIMITS.PHP TO TRANSLATE MORE,
518,1,55833.0,"Anomalías y síndromes cromosómicos, excepto Down: Nivel 3",MYMEMORY WARNING: YOU USED ALL AVAILABLE FREE TRANSLATIONS FOR TODAY. NEXT AVAILABLE IN  09 HOURS 30 MINUTES 01 SECONDSVISIT HTTPS://MYMEMORY.TRANSLATED.NET/DOC/USAGELIMITS.PHP TO TRANSLATE MORE,
617,1,61313.0,Enfermedad cerebrovascular y otra enfermedad dominante crónica,MYMEMORY WARNING: YOU USED ALL AVAILABLE FREE TRANSLATIONS FOR TODAY. NEXT AVAILABLE IN  09 HOURS 30 MINUTES 01 SECONDSVISIT HTTPS://MYMEMORY.TRANSLATED.NET/DOC/USAGELIMITS.PHP TO TRANSLATE MORE,
651,1,30171.0,Anomalías de la marcha: Nivel 1,MYMEMORY WARNING: YOU USED ALL AVAILABLE FREE TRANSLATIONS FOR TODAY. NEXT AVAILABLE IN  09 HOURS 30 MINUTES 01 SECONDSVISIT HTTPS://MYMEMORY.TRANSLATED.NET/DOC/USAGELIMITS.PHP TO TRANSLATE MORE,
554,1,56074.0,Trastornos de la coagulación: Nivel 4,MYMEMORY WARNING: YOU USED ALL AVAILABLE FREE TRANSLATIONS FOR TODAY. NEXT AVAILABLE IN  09 HOURS 30 MINUTES 01 SECONDSVISIT HTTPS://MYMEMORY.TRANSLATED.NET/DOC/USAGELIMITS.PHP TO TRANSLATE MORE,
162,1,52383.0,Enfermedad vascular periférica: Nivel 3,MYMEMORY WARNING: YOU USED ALL AVAILABLE FREE TRANSLATIONS FOR TODAY. NEXT AVAILABLE IN  09 HOURS 30 MINUTES 01 SECONDSVISIT HTTPS://MYMEMORY.TRANSLATED.NET/DOC/USAGELIMITS.PHP TO TRANSLATE MORE,
461,1,51782.0,Otros diagnósticos cardiacos congénitos mayores excepto valvulares: Nivel 2,MYMEMORY WARNING: YOU USED ALL AVAILABLE FREE TRANSLATIONS FOR TODAY. NEXT AVAILABLE IN  09 HOURS 30 MINUTES 01 SECONDSVISIT HTTPS://MYMEMORY.TRANSLATED.NET/DOC/USAGELIMITS.PHP TO TRANSLATE MORE,
323,1,61223.0,EPOC y otra enfermedad dominante crónica: Nivel 3,MYMEMORY WARNING: YOU USED ALL AVAILABLE FREE TRANSLATIONS FOR TODAY. NEXT AVAILABLE IN  09 HOURS 30 MINUTES 01 SECONDSVISIT HTTPS://MYMEMORY.TRANSLATED.NET/DOC/USAGELIMITS.PHP TO TRANSLATE MORE,
1069,1,51344.0,Otros diagnósticos pulmonares crónicos mayores: Nivel 4,MYMEMORY WARNING: YOU USED ALL AVAILABLE FREE TRANSLATIONS FOR TODAY. NEXT AVAILABLE IN  09 HOURS 30 MINUTES 01 SECONDSVISIT HTTPS://MYMEMORY.TRANSLATED.NET/DOC/USAGELIMITS.PHP TO TRANSLATE MORE,
905,1,62904.0,"Enfermedad psiquiátrica (excepto esquizofrenia) y otra enfermedad crónica, Nivel 2: Nivel 4",MYMEMORY WARNING: YOU USED ALL AVAILABLE FREE TRANSLATIONS FOR TODAY. NEXT AVAILABLE IN  09 HOURS 26 MINUTES 29 SECONDSVISIT HTTPS://MYMEMORY.TRANSLATED.NET/DOC/USAGELIMITS.PHP TO TRANSLATE MORE,
533,1,57823.0,Abuso de cocaina: Nivel 3,MYMEMORY WARNING: YOU USED ALL AVAILABLE FREE TRANSLATIONS FOR TODAY. NEXT AVAILABLE IN  09 HOURS 26 MINUTES 29 SECONDSVISIT HTTPS://MYMEMORY.TRANSLATED.NET/DOC/USAGELIMITS.PHP TO TRANSLATE MORE,
1006,1,62104.0,Otra enfermedad dominante crónica y neoplasia de mama: Nivel 4,MYMEMORY WARNING: YOU USED ALL AVAILABLE FREE TRANSLATIONS FOR TODAY. NEXT AVAILABLE IN  09 HOURS 30 MINUTES 00 SECONDSVISIT HTTPS://MYMEMORY.TRANSLATED.NET/DOC/USAGELIMITS.PHP TO TRANSLATE MORE,
276,1,10110.0,Diagnósticos neurológicos significativos sin otra enfermedad significativa,MYMEMORY WARNING: YOU USED ALL AVAILABLE FREE TRANSLATIONS FOR TODAY. NEXT AVAILABLE IN  09 HOURS 30 MINUTES 00 SECONDSVISIT HTTPS://MYMEMORY.TRANSLATED.NET/DOC/USAGELIMITS.PHP TO TRANSLATE MORE,
252,1,62001.0,Otra enfermedad dominante crónica y enfermedad psiquiátrica (excepto esquizofrenia): Nivel 1,MYMEMORY WARNING: YOU USED ALL AVAILABLE FREE TRANSLATIONS FOR TODAY. NEXT AVAILABLE IN  09 HOURS 30 MINUTES 00 SECONDSVISIT HTTPS://MYMEMORY.TRANSLATED.NET/DOC/USAGELIMITS.PHP TO TRANSLATE MORE,
60,1,20860.0,Diagnósticos de diabetes con otra enfermedad significativa,MYMEMORY WARNING: YOU USED ALL AVAILABLE FREE TRANSLATIONS FOR TODAY. NEXT AVAILABLE IN  09 HOURS 30 MINUTES 00 SECONDSVISIT HTTPS://MYMEMORY.TRANSLATED.NET/DOC/USAGELIMITS.PHP TO TRANSLATE MORE,
381,1,50033.0,Hemiplejia adquirida: Nivel 3,MYMEMORY WARNING: YOU USED ALL AVAILABLE FREE TRANSLATIONS FOR TODAY. NEXT AVAILABLE IN  09 HOURS 30 MINUTES 00 SECONDSVISIT HTTPS://MYMEMORY.TRANSLATED.NET/DOC/USAGELIMITS.PHP TO TRANSLATE MORE,
755,1,50044.0,Enfermedad cerebrovascular con infarto o hemorragia intracraneal: Nivel 4,MYMEMORY WARNING: YOU USED ALL AVAILABLE FREE TRANSLATIONS FOR TODAY. NEXT AVAILABLE IN  09 HOURS 30 MINUTES 00 SECONDSVISIT HTTPS://MYMEMORY.TRANSLATED.NET/DOC/USAGELIMITS.PHP TO TRANSLATE MORE,
980,1,54773.0,Nefritis: Nivel 3,MYMEMORY WARNING: YOU USED ALL AVAILABLE FREE TRANSLATIONS FOR TODAY. NEXT AVAILABLE IN  09 HOURS 30 MINUTES 00 SECONDSVISIT HTTPS://MYMEMORY.TRANSLATED.NET/DOC/USAGELIMITS.PHP TO TRANSLATE MORE,
658,1,61515.0,Enfermedad coronaria avanzada y otra enfermedad moderada crónica: Nivel 5,MYMEMORY WARNING: YOU USED ALL AVAILABLE FREE TRANSLATIONS FOR TODAY. NEXT AVAILABLE IN  09 HOURS 26 MINUTES 28 SECONDSVISIT HTTPS://MYMEMORY.TRANSLATED.NET/DOC/USAGELIMITS.PHP TO TRANSLATE MORE,
161,1,62913.0,"Asma y otra enfermedad crónica, Nivel 2: Nivel 3",MYMEMORY WARNING: YOU USED ALL AVAILABLE FREE TRANSLATIONS FOR TODAY. NEXT AVAILABLE IN  09 HOURS 30 MINUTES 00 SECONDSVISIT HTTPS://MYMEMORY.TRANSLATED.NET/DOC/USAGELIMITS.PHP TO TRANSLATE MORE,
415,1,61602.0,Demencia y otra enfermedad dominante crónica: Nivel 2,MYMEMORY WARNING: YOU USED ALL AVAILABLE FREE TRANSLATIONS FOR TODAY. NEXT AVAILABLE IN  09 HOURS 29 MINUTES 59 SECONDSVISIT HTTPS://MYMEMORY.TRANSLATED.NET/DOC/USAGELIMITS.PHP TO TRANSLATE MORE,
352,1,51883.0,Historia de by-pass coronario: Nivel 3,MYMEMORY WARNING: YOU USED ALL AVAILABLE FREE TRANSLATIONS FOR TODAY. NEXT AVAILABLE IN  09 HOURS 29 MINUTES 59 SECONDSVISIT HTTPS://MYMEMORY.TRANSLATED.NET/DOC/USAGELIMITS.PHP TO TRANSLATE MORE,
23,1,50043.0,Enfermedad cerebrovascular con infarto o hemorragia intracraneal: Nivel 3,MYMEMORY WARNING: YOU USED ALL AVAILABLE FREE TRANSLATIONS FOR TODAY. NEXT AVAILABLE IN  09 HOURS 29 MINUTES 59 SECONDSVISIT HTTPS://MYMEMORY.TRANSLATED.NET/DOC/USAGELIMITS.PHP TO TRANSLATE MORE,
24,1,70022.0,Insuficiencia renal crónica - Dos o más enfermedades crónicas dominantes: Nivel 2,MYMEMORY WARNING: YOU USED ALL AVAILABLE FREE TRANSLATIONS FOR TODAY. NEXT AVAILABLE IN  09 HOURS 26 MINUTES 28 SECONDSVISIT HTTPS://MYMEMORY.TRANSLATED.NET/DOC/USAGELIMITS.PHP TO TRANSLATE MORE,
723,1,61004.0,Insuficiencia renal crónica y otras enfermedades crónicas dominantes o moderadas: Nivel 4,MYMEMORY WARNING: YOU USED ALL AVAILABLE FREE TRANSLATIONS FOR TODAY. NEXT AVAILABLE IN  09 HOURS 29 MINUTES 59 SECONDSVISIT HTTPS://MYMEMORY.TRANSLATED.NET/DOC/USAGELIMITS.PHP TO TRANSLATE MORE,
843,1,56541.0,Mieloma múltiple: Nivel 1,MYMEMORY WARNING: YOU USED ALL AVAILABLE FREE TRANSLATIONS FOR TODAY. NEXT AVAILABLE IN  09 HOURS 26 MINUTES 28 SECONDSVISIT HTTPS://MYMEMORY.TRANSLATED.NET/DOC/USAGELIMITS.PHP TO TRANSLATE MORE,
382,1,70206.0,Diabetes - Enfermedad coronaria avanzada - Otra enfermedad crónica dominante: Nivel 6,MYMEMORY WARNING: YOU USED ALL AVAILABLE FREE TRANSLATIONS FOR TODAY. NEXT AVAILABLE IN  09 HOURS 29 MINUTES 59 SECONDSVISIT HTTPS://MYMEMORY.TRANSLATED.NET/DOC/USAGELIMITS.PHP TO TRANSLATE MORE,
847,1,53902.0,Enfermedades del tejido conectivo y vasculitis: Nivel 2,MYMEMORY WARNING: YOU USED ALL AVAILABLE FREE TRANSLATIONS FOR TODAY. NEXT AVAILABLE IN  09 HOURS 29 MINUTES 59 SECONDSVISIT HTTPS://MYMEMORY.TRANSLATED.NET/DOC/USAGELIMITS.PHP TO TRANSLATE MORE,
541,1,50051.0,Diagnósticos neurodegenerativos excepto esclerosis múltiple y Parkinson: Nivel 1,MYMEMORY WARNING: YOU USED ALL AVAILABLE FREE TRANSLATIONS FOR TODAY. NEXT AVAILABLE IN  09 HOURS 29 MINUTES 59 SECONDSVISIT HTTPS://MYMEMORY.TRANSLATED.NET/DOC/USAGELIMITS.PHP TO TRANSLATE MORE,
858,1,86542.0,Mieloma múltiple: Nivel 2,MYMEMORY WARNING: YOU USED ALL AVAILABLE FREE TRANSLATIONS FOR TODAY. NEXT AVAILABLE IN  09 HOURS 29 MINUTES 59 SECONDSVISIT HTTPS://MYMEMORY.TRANSLATED.NET/DOC/USAGELIMITS.PHP TO TRANSLATE MORE,
319,1,61816.0,"Historia de fractura de cadera, edad > 64 y otra enfermedad moderada crónica: Nivel 6",MYMEMORY WARNING: YOU USED ALL AVAILABLE FREE TRANSLATIONS FOR TODAY. NEXT AVAILABLE IN  09 HOURS 26 MINUTES 27 SECONDSVISIT HTTPS://MYMEMORY.TRANSLATED.NET/DOC/USAGELIMITS.PHP TO TRANSLATE MORE,
248,1,70123.0,Insuficiencia cardiaca - Diabetes - Otra enfermedad crónica dominante: Nivel 3,MYMEMORY WARNING: YOU USED ALL AVAILABLE FREE TRANSLATIONS FOR TODAY. NEXT AVAILABLE IN  09 HOURS 26 MINUTES 27 SECONDSVISIT HTTPS://MYMEMORY.TRANSLATED.NET/DOC/USAGELIMITS.PHP TO TRANSLATE MORE,
349,1,70156.0,Insuficiencia cardiaca - Enfermedad cerebrovascular - Otra enfermedad crónica dominante: Nivel 6,MYMEMORY WARNING: YOU USED ALL AVAILABLE FREE TRANSLATIONS FOR TODAY. NEXT AVAILABLE IN  09 HOURS 29 MINUTES 58 SECONDSVISIT HTTPS://MYMEMORY.TRANSLATED.NET/DOC/USAGELIMITS.PHP TO TRANSLATE MORE,
315,1,53104.0,Enfermedad hepática alcohólica: Nivel 4,MYMEMORY WARNING: YOU USED ALL AVAILABLE FREE TRANSLATIONS FOR TODAY. NEXT AVAILABLE IN  09 HOURS 29 MINUTES 58 SECONDSVISIT HTTPS://MYMEMORY.TRANSLATED.NET/DOC/USAGELIMITS.PHP TO TRANSLATE MORE,
989,1,61104.0,EPOC e Insuficiencia cardiaca: Nivel 4,MYMEMORY WARNING: YOU USED ALL AVAILABLE FREE TRANSLATIONS FOR TODAY. NEXT AVAILABLE IN  09 HOURS 26 MINUTES 27 SECONDSVISIT HTTPS://MYMEMORY.TRANSLATED.NET/DOC/USAGELIMITS.PHP TO TRANSLATE MORE,
997,1,54771.0,Nefritis: Nivel 1,MYMEMORY WARNING: YOU USED ALL AVAILABLE FREE TRANSLATIONS FOR TODAY. NEXT AVAILABLE IN  09 HOURS 26 MINUTES 27 SECONDSVISIT HTTPS://MYMEMORY.TRANSLATED.NET/DOC/USAGELIMITS.PHP TO TRANSLATE MORE,
1092,1,50743.0,Degeneración macular: Nivel 3,MYMEMORY WARNING: YOU USED ALL AVAILABLE FREE TRANSLATIONS FOR TODAY. NEXT AVAILABLE IN  09 HOURS 29 MINUTES 58 SECONDSVISIT HTTPS://MYMEMORY.TRANSLATED.NET/DOC/USAGELIMITS.PHP TO TRANSLATE MORE,
588,1,30191.0,Diagnósticos neuromusculares crónicos y otros diagnósticos neurológicos : Menor Nivel 1,MYMEMORY WARNING: YOU USED ALL AVAILABLE FREE TRANSLATIONS FOR TODAY. NEXT AVAILABLE IN  09 HOURS 29 MINUTES 58 SECONDSVISIT HTTPS://MYMEMORY.TRANSLATED.NET/DOC/USAGELIMITS.PHP TO TRANSLATE MORE,
280,1,56611.0,Neoplasia de proteinas plasmáticas: Nivel 1,MYMEMORY WARNING: YOU USED ALL AVAILABLE FREE TRANSLATIONS FOR TODAY. NEXT AVAILABLE IN  09 HOURS 26 MINUTES 26 SECONDSVISIT HTTPS://MYMEMORY.TRANSLATED.NET/DOC/USAGELIMITS.PHP TO TRANSLATE MORE,
370,1,70122.0,Insuficiencia cardiaca - Diabetes - Otra enfermedad crónica dominante: Nivel 2,MYMEMORY WARNING: YOU USED ALL AVAILABLE FREE TRANSLATIONS FOR TODAY. NEXT AVAILABLE IN  09 HOURS 29 MINUTES 58 SECONDSVISIT HTTPS://MYMEMORY.TRANSLATED.NET/DOC/USAGELIMITS.PHP TO TRANSLATE MORE,
964,1,57432.0,Esquizofrenia: Nivel 2,MYMEMORY WARNING: YOU USED ALL AVAILABLE FREE TRANSLATIONS FOR TODAY. NEXT AVAILABLE IN  09 HOURS 29 MINUTES 58 SECONDSVISIT HTTPS://MYMEMORY.TRANSLATED.NET/DOC/USAGELIMITS.PHP TO TRANSLATE MORE,
316,1,61315.0,Enfermedad cerebrovascular y otra enfermedad dominante crónica,MYMEMORY WARNING: YOU USED ALL AVAILABLE FREE TRANSLATIONS FOR TODAY. NEXT AVAILABLE IN  09 HOURS 29 MINUTES 58 SECONDSVISIT HTTPS://MYMEMORY.TRANSLATED.NET/DOC/USAGELIMITS.PHP TO TRANSLATE MORE,
805,1,90901.0,Espina bífida: Nivel 1,MYMEMORY WARNING: YOU USED ALL AVAILABLE FREE TRANSLATIONS FOR TODAY. NEXT AVAILABLE IN  09 HOURS 29 MINUTES 57 SECONDSVISIT HTTPS://MYMEMORY.TRANSLATED.NET/DOC/USAGELIMITS.PHP TO TRANSLATE MORE,
230,1,34091.0,Psoriasis: Nivel 1,MYMEMORY WARNING: YOU USED ALL AVAILABLE FREE TRANSLATIONS FOR TODAY. NEXT AVAILABLE IN  09 HOURS 29 MINUTES 57 SECONDSVISIT HTTPS://MYMEMORY.TRANSLATED.NET/DOC/USAGELIMITS.PHP TO TRANSLATE MORE,
838,1,35242.0,"Infertilidad, mujer: Nivel 2",MYMEMORY WARNING: YOU USED ALL AVAILABLE FREE TRANSLATIONS FOR TODAY. NEXT AVAILABLE IN  09 HOURS 26 MINUTES 26 SECONDSVISIT HTTPS://MYMEMORY.TRANSLATED.NET/DOC/USAGELIMITS.PHP TO TRANSLATE MORE,
788,1,20810.0,Diagnósticos neurológicos significativos con otra enfermedad significativa,MYMEMORY WARNING: YOU USED ALL AVAILABLE FREE TRANSLATIONS FOR TODAY. NEXT AVAILABLE IN  09 HOURS 26 MINUTES 26 SECONDSVISIT HTTPS://MYMEMORY.TRANSLATED.NET/DOC/USAGELIMITS.PHP TO TRANSLATE MORE,
368,1,91004.0,Distrofia muscular progresiva o atrofia espinal muscular: Nivel 4,MYMEMORY WARNING: YOU USED ALL AVAILABLE FREE TRANSLATIONS FOR TODAY. NEXT AVAILABLE IN  09 HOURS 26 MINUTES 26 SECONDSVISIT HTTPS://MYMEMORY.TRANSLATED.NET/DOC/USAGELIMITS.PHP TO TRANSLATE MORE,
351,1,61232.0,EPOC y otra enfermedad moderada crónica,MYMEMORY WARNING: YOU USED ALL AVAILABLE FREE TRANSLATIONS FOR TODAY. NEXT AVAILABLE IN  09 HOURS 29 MINUTES 57 SECONDSVISIT HTTPS://MYMEMORY.TRANSLATED.NET/DOC/USAGELIMITS.PHP TO TRANSLATE MORE,
520,1,70016.0,Insuficiencia renal crónica - Otra enfermedad crónica dominante: Nivel 6,MYMEMORY WARNING: YOU USED ALL AVAILABLE FREE TRANSLATIONS FOR TODAY. NEXT AVAILABLE IN  09 HOURS 26 MINUTES 26 SECONDSVISIT HTTPS://MYMEMORY.TRANSLATED.NET/DOC/USAGELIMITS.PHP TO TRANSLATE MORE,
660,1,80024.0,Neoplasias no dominantes primarias múltiples: Nivel 4,MYMEMORY WARNING: YOU USED ALL AVAILABLE FREE TRANSLATIONS FOR TODAY. NEXT AVAILABLE IN  09 HOURS 26 MINUTES 25 SECONDSVISIT HTTPS://MYMEMORY.TRANSLATED.NET/DOC/USAGELIMITS.PHP TO TRANSLATE MORE,
758,1,50102.0,Hidrocefalia y otras anomalías cerebrales: Nivel 2,MYMEMORY WARNING: YOU USED ALL AVAILABLE FREE TRANSLATIONS FOR TODAY. NEXT AVAILABLE IN  09 HOURS 29 MINUTES 57 SECONDSVISIT HTTPS://MYMEMORY.TRANSLATED.NET/DOC/USAGELIMITS.PHP TO TRANSLATE MORE,
750,1,86532.0,Leucemia no linfática crónica: Nivel 2,MYMEMORY WARNING: YOU USED ALL AVAILABLE FREE TRANSLATIONS FOR TODAY. NEXT AVAILABLE IN  09 HOURS 29 MINUTES 57 SECONDSVISIT HTTPS://MYMEMORY.TRANSLATED.NET/DOC/USAGELIMITS.PHP TO TRANSLATE MORE,
717,1,34102.0,Diagnósticos crónicos de piel - menor: Nivel 2,MYMEMORY WARNING: YOU USED ALL AVAILABLE FREE TRANSLATIONS FOR TODAY. NEXT AVAILABLE IN  09 HOURS 29 MINUTES 57 SECONDSVISIT HTTPS://MYMEMORY.TRANSLATED.NET/DOC/USAGELIMITS.PHP TO TRANSLATE MORE,
264,1,52414.0,Varices en piernas con úlceras o inflamación: Nivel 4,MYMEMORY WARNING: YOU USED ALL AVAILABLE FREE TRANSLATIONS FOR TODAY. NEXT AVAILABLE IN  09 HOURS 29 MINUTES 56 SECONDSVISIT HTTPS://MYMEMORY.TRANSLATED.NET/DOC/USAGELIMITS.PHP TO TRANSLATE MORE,
482,1,52703.0,Diagnósticos gastrointestinales crónicos - moderado: Nivel 3,MYMEMORY WARNING: YOU USED ALL AVAILABLE FREE TRANSLATIONS FOR TODAY. NEXT AVAILABLE IN  09 HOURS 29 MINUTES 56 SECONDSVISIT HTTPS://MYMEMORY.TRANSLATED.NET/DOC/USAGELIMITS.PHP TO TRANSLATE MORE,
501,1,36981.0,Neoplasias de comportamiento incierto: Nivel 1,MYMEMORY WARNING: YOU USED ALL AVAILABLE FREE TRANSLATIONS FOR TODAY. NEXT AVAILABLE IN  09 HOURS 26 MINUTES 25 SECONDSVISIT HTTPS://MYMEMORY.TRANSLATED.NET/DOC/USAGELIMITS.PHP TO TRANSLATE MORE,
941,1,54742.0,Estado de trasplante renal: Nivel 2,MYMEMORY WARNING: YOU USED ALL AVAILABLE FREE TRANSLATIONS FOR TODAY. NEXT AVAILABLE IN  09 HOURS 29 MINUTES 56 SECONDSVISIT HTTPS://MYMEMORY.TRANSLATED.NET/DOC/USAGELIMITS.PHP TO TRANSLATE MORE,
1056,1,56562.0,Leucemia no linfática aguda: Nivel 2,MYMEMORY WARNING: YOU USED ALL AVAILABLE FREE TRANSLATIONS FOR TODAY. NEXT AVAILABLE IN  09 HOURS 29 MINUTES 56 SECONDSVISIT HTTPS://MYMEMORY.TRANSLATED.NET/DOC/USAGELIMITS.PHP TO TRANSLATE MORE,
